Frame 1: 86 bytes on wire (688 bits), 86 bytes captured (688 bits)
    Encapsulation type: Ethernet (1)
    Arrival Time: Sep 30, 2025 11:02:58.009936000 EDT
    UTC Arrival Time: Sep 30, 2025 15:02:58.009936000 UTC
    Epoch Arrival Time: 1759244578.009936000
    [Time shift for this packet: 0.000000000 seconds]
    [Time delta from previous captured frame: 0.000000000 seconds]
    [Time delta from previous displayed frame: 0.000000000 seconds]
    [Time since reference or first frame: 0.000000000 seconds]
    Frame Number: 1
    Frame Length: 86 bytes (688 bits)
    Capture Length: 86 bytes (688 bits)
    [Frame is marked: False]
    [Frame is ignored: False]
    [Protocols in frame: eth:ethertype:ipv6:icmpv6]
Ethernet II, Src: 2e:b4:69:6b:dd:a0 (2e:b4:69:6b:dd:a0), Dst: PCSSystemtec_9b:96:7d (08:00:27:9b:96:7d)
    Destination: PCSSystemtec_9b:96:7d (08:00:27:9b:96:7d)
        .... ..0. .... .... .... .... = LG bit: Globally unique address (factory default)
        .... ...0 .... .... .... .... = IG bit: Individual address (unicast)
    Source: 2e:b4:69:6b:dd:a0 (2e:b4:69:6b:dd:a0)
        .... ..1. .... .... .... .... = LG bit: Locally administered address (this is NOT the factory default)
        .... ...0 .... .... .... .... = IG bit: Individual address (unicast)
    Type: IPv6 (0x86dd)
    [Stream index: 0]
Internet Protocol Version 6, Src: fe80::2cb4:69ff:fe6b:dda0, Dst: fe80::221:fe8a:4491:f36b
    0110 .... = Version: 6
    .... 0000 0000 .... .... .... .... .... = Traffic Class: 0x00 (DSCP: CS0, ECN: Not-ECT)
        .... 0000 00.. .... .... .... .... .... = Differentiated Services Codepoint: Default (0)
        .... .... ..00 .... .... .... .... .... = Explicit Congestion Notification: Not ECN-Capable Transport (0)
    .... 0000 0000 0000 0000 0000 = Flow Label: 0x00000
    Payload Length: 32
    Next Header: ICMPv6 (58)
    Hop Limit: 255
    Source Address: fe80::2cb4:69ff:fe6b:dda0
        [Address Space: Link-Local Unicast]
        [Special-Purpose Allocation: Link-Local Unicast]
            [Source: True]
            [Destination: True]
            [Forwardable: False]
            [Globally Reachable: False]
            [Reserved-by-Protocol: True]
    Destination Address: fe80::221:fe8a:4491:f36b
        [Address Space: Link-Local Unicast]
        [Special-Purpose Allocation: Link-Local Unicast]
            [Source: True]
            [Destination: True]
            [Forwardable: False]
            [Globally Reachable: False]
            [Reserved-by-Protocol: True]
    [Stream index: 0]
Internet Control Message Protocol v6
    Type: Neighbor Solicitation (135)
    Code: 0
    Checksum: 0x224e [correct]
    [Checksum Status: Good]
    Reserved: 00000000
    Target Address: fe80::221:fe8a:4491:f36b
    ICMPv6 Option (Source link-layer address : 2e:b4:69:6b:dd:a0)
        Type: Source link-layer address (1)
        Length: 1 (8 bytes)
        Link-layer address: 2e:b4:69:6b:dd:a0 (2e:b4:69:6b:dd:a0)

Frame 2: 78 bytes on wire (624 bits), 78 bytes captured (624 bits)
    Encapsulation type: Ethernet (1)
    Arrival Time: Sep 30, 2025 11:02:58.009973000 EDT
    UTC Arrival Time: Sep 30, 2025 15:02:58.009973000 UTC
    Epoch Arrival Time: 1759244578.009973000
    [Time shift for this packet: 0.000000000 seconds]
    [Time delta from previous captured frame: 0.000037000 seconds]
    [Time delta from previous displayed frame: 0.000037000 seconds]
    [Time since reference or first frame: 0.000037000 seconds]
    Frame Number: 2
    Frame Length: 78 bytes (624 bits)
    Capture Length: 78 bytes (624 bits)
    [Frame is marked: False]
    [Frame is ignored: False]
    [Protocols in frame: eth:ethertype:ipv6:icmpv6]
Ethernet II, Src: PCSSystemtec_9b:96:7d (08:00:27:9b:96:7d), Dst: 2e:b4:69:6b:dd:a0 (2e:b4:69:6b:dd:a0)
    Destination: 2e:b4:69:6b:dd:a0 (2e:b4:69:6b:dd:a0)
        .... ..1. .... .... .... .... = LG bit: Locally administered address (this is NOT the factory default)
        .... ...0 .... .... .... .... = IG bit: Individual address (unicast)
    Source: PCSSystemtec_9b:96:7d (08:00:27:9b:96:7d)
        .... ..0. .... .... .... .... = LG bit: Globally unique address (factory default)
        .... ...0 .... .... .... .... = IG bit: Individual address (unicast)
    Type: IPv6 (0x86dd)
    [Stream index: 0]
Internet Protocol Version 6, Src: fe80::221:fe8a:4491:f36b, Dst: fe80::2cb4:69ff:fe6b:dda0
    0110 .... = Version: 6
    .... 0000 0000 .... .... .... .... .... = Traffic Class: 0x00 (DSCP: CS0, ECN: Not-ECT)
        .... 0000 00.. .... .... .... .... .... = Differentiated Services Codepoint: Default (0)
        .... .... ..00 .... .... .... .... .... = Explicit Congestion Notification: Not ECN-Capable Transport (0)
    .... 0000 0000 0000 0000 0000 = Flow Label: 0x00000
    Payload Length: 24
    Next Header: ICMPv6 (58)
    Hop Limit: 255
    Source Address: fe80::221:fe8a:4491:f36b
        [Address Space: Link-Local Unicast]
        [Special-Purpose Allocation: Link-Local Unicast]
            [Source: True]
            [Destination: True]
            [Forwardable: False]
            [Globally Reachable: False]
            [Reserved-by-Protocol: True]
    Destination Address: fe80::2cb4:69ff:fe6b:dda0
        [Address Space: Link-Local Unicast]
        [Special-Purpose Allocation: Link-Local Unicast]
            [Source: True]
            [Destination: True]
            [Forwardable: False]
            [Globally Reachable: False]
            [Reserved-by-Protocol: True]
    [Stream index: 0]
Internet Control Message Protocol v6
    Type: Neighbor Advertisement (136)
    Code: 0
    Checksum: 0x5817 [correct]
    [Checksum Status: Good]
    Flags: 0x40000000, Solicited
        0... .... .... .... .... .... .... .... = Router: Not set
        .1.. .... .... .... .... .... .... .... = Solicited: Set
        ..0. .... .... .... .... .... .... .... = Override: Not set
        ...0 0000 0000 0000 0000 0000 0000 0000 = Reserved: 0
    Target Address: fe80::221:fe8a:4491:f36b

Frame 3: 98 bytes on wire (784 bits), 98 bytes captured (784 bits)
    Encapsulation type: Ethernet (1)
    Arrival Time: Sep 30, 2025 11:02:59.340605000 EDT
    UTC Arrival Time: Sep 30, 2025 15:02:59.340605000 UTC
    Epoch Arrival Time: 1759244579.340605000
    [Time shift for this packet: 0.000000000 seconds]
    [Time delta from previous captured frame: 1.330632000 seconds]
    [Time delta from previous displayed frame: 1.330632000 seconds]
    [Time since reference or first frame: 1.330669000 seconds]
    Frame Number: 3
    Frame Length: 98 bytes (784 bits)
    Capture Length: 98 bytes (784 bits)
    [Frame is marked: False]
    [Frame is ignored: False]
    [Protocols in frame: eth:ethertype:ipv6:tcp:tls]
Ethernet II, Src: 2e:b4:69:6b:dd:a0 (2e:b4:69:6b:dd:a0), Dst: CloudNetwork_28:03:b3 (d8:b3:2f:28:03:b3)
    Destination: CloudNetwork_28:03:b3 (d8:b3:2f:28:03:b3)
        .... ..0. .... .... .... .... = LG bit: Globally unique address (factory default)
        .... ...0 .... .... .... .... = IG bit: Individual address (unicast)
    Source: 2e:b4:69:6b:dd:a0 (2e:b4:69:6b:dd:a0)
        .... ..1. .... .... .... .... = LG bit: Locally administered address (this is NOT the factory default)
        .... ...0 .... .... .... .... = IG bit: Individual address (unicast)
    Type: IPv6 (0x86dd)
    [Stream index: 1]
Internet Protocol Version 6, Src: 2a06:98c1:3108::ac40:94eb, Dst: 2402:3a80:4225:2b37:550b:b939:288f:d13d
    0110 .... = Version: 6
    .... 1000 1000 .... .... .... .... .... = Traffic Class: 0x88 (DSCP: AF41, ECN: Not-ECT)
        .... 1000 10.. .... .... .... .... .... = Differentiated Services Codepoint: Assured Forwarding 41 (34)
        .... .... ..00 .... .... .... .... .... = Explicit Congestion Notification: Not ECN-Capable Transport (0)
    .... 1001 1001 0000 1010 1010 = Flow Label: 0x990aa
    Payload Length: 44
    Next Header: TCP (6)
    Hop Limit: 56
    Source Address: 2a06:98c1:3108::ac40:94eb
        [Address Space: Global Unicast]
    Destination Address: 2402:3a80:4225:2b37:550b:b939:288f:d13d
        [Address Space: Global Unicast]
    [Stream index: 1]
Transmission Control Protocol, Src Port: 443, Dst Port: 51663, Seq: 1, Ack: 1, Len: 24
    Source Port: 443
    Destination Port: 51663
    [Stream index: 0]
    [Stream Packet Number: 1]
    [Conversation completeness: Incomplete (0)]
        ..0. .... = RST: Absent
        ...0 .... = FIN: Absent
        .... 0... = Data: Absent
        .... .0.. = ACK: Absent
        .... ..0. = SYN-ACK: Absent
        .... ...0 = SYN: Absent
        [Completeness Flags: [ Null ]]
    [TCP Segment Len: 24]
    Sequence Number: 1    (relative sequence number)
    Sequence Number (raw): 2785726077
    [Next Sequence Number: 25    (relative sequence number)]
    Acknowledgment Number: 1    (relative ack number)
    Acknowledgment number (raw): 2821470829
    0101 .... = Header Length: 20 bytes (5)
    Flags: 0x018 (PSH, ACK)
        000. .... .... = Reserved: Not set
        ...0 .... .... = Accurate ECN: Not set
        .... 0... .... = Congestion Window Reduced: Not set
        .... .0.. .... = ECN-Echo: Not set
        .... ..0. .... = Urgent: Not set
        .... ...1 .... = Acknowledgment: Set
        .... .... 1... = Push: Set
        .... .... .0.. = Reset: Not set
        .... .... ..0. = Syn: Not set
        .... .... ...0 = Fin: Not set
        [TCP Flags: ·······AP···]
    Window: 19
    [Calculated window size: 19]
    [Window size scaling factor: -1 (unknown)]
    Checksum: 0xf699 [unverified]
    [Checksum Status: Unverified]
    Urgent Pointer: 0
    [Timestamps]
        [Time since first frame in this TCP stream: 0.000000000 seconds]
        [Time since previous frame in this TCP stream: 0.000000000 seconds]
    [SEQ/ACK analysis]
        [Bytes in flight: 24]
        [Bytes sent since last PSH flag: 24]
    TCP payload (24 bytes)
Transport Layer Security
    TLSv1.2 Record Layer: Application Data Protocol: Hypertext Transfer Protocol
        Content Type: Application Data (23)
        Version: TLS 1.2 (0x0303)
        Length: 19
        Encrypted Application Data: a4e4e796d3bb212e2d76047289747c73962a1c
        [Application Data Protocol: Hypertext Transfer Protocol]

Frame 4: 102 bytes on wire (816 bits), 102 bytes captured (816 bits)
    Encapsulation type: Ethernet (1)
    Arrival Time: Sep 30, 2025 11:02:59.340973000 EDT
    UTC Arrival Time: Sep 30, 2025 15:02:59.340973000 UTC
    Epoch Arrival Time: 1759244579.340973000
    [Time shift for this packet: 0.000000000 seconds]
    [Time delta from previous captured frame: 0.000368000 seconds]
    [Time delta from previous displayed frame: 0.000368000 seconds]
    [Time since reference or first frame: 1.331037000 seconds]
    Frame Number: 4
    Frame Length: 102 bytes (816 bits)
    Capture Length: 102 bytes (816 bits)
    [Frame is marked: False]
    [Frame is ignored: False]
    [Protocols in frame: eth:ethertype:ipv6:tcp:tls]
Ethernet II, Src: CloudNetwork_28:03:b3 (d8:b3:2f:28:03:b3), Dst: 2e:b4:69:6b:dd:a0 (2e:b4:69:6b:dd:a0)
    Destination: 2e:b4:69:6b:dd:a0 (2e:b4:69:6b:dd:a0)
        .... ..1. .... .... .... .... = LG bit: Locally administered address (this is NOT the factory default)
        .... ...0 .... .... .... .... = IG bit: Individual address (unicast)
    Source: CloudNetwork_28:03:b3 (d8:b3:2f:28:03:b3)
        .... ..0. .... .... .... .... = LG bit: Globally unique address (factory default)
        .... ...0 .... .... .... .... = IG bit: Individual address (unicast)
    Type: IPv6 (0x86dd)
    [Stream index: 1]
Internet Protocol Version 6, Src: 2402:3a80:4225:2b37:550b:b939:288f:d13d, Dst: 2a06:98c1:3108::ac40:94eb
    0110 .... = Version: 6
    .... 0000 0000 .... .... .... .... .... = Traffic Class: 0x00 (DSCP: CS0, ECN: Not-ECT)
        .... 0000 00.. .... .... .... .... .... = Differentiated Services Codepoint: Default (0)
        .... .... ..00 .... .... .... .... .... = Explicit Congestion Notification: Not ECN-Capable Transport (0)
    .... 1111 1000 1110 0000 0100 = Flow Label: 0xf8e04
    Payload Length: 48
    Next Header: TCP (6)
    Hop Limit: 254
    Source Address: 2402:3a80:4225:2b37:550b:b939:288f:d13d
        [Address Space: Global Unicast]
    Destination Address: 2a06:98c1:3108::ac40:94eb
        [Address Space: Global Unicast]
    [Stream index: 1]
Transmission Control Protocol, Src Port: 51663, Dst Port: 443, Seq: 1, Ack: 25, Len: 28
    Source Port: 51663
    Destination Port: 443
    [Stream index: 0]
    [Stream Packet Number: 2]
    [Conversation completeness: Incomplete (8)]
        ..0. .... = RST: Absent
        ...0 .... = FIN: Absent
        .... 1... = Data: Present
        .... .0.. = ACK: Absent
        .... ..0. = SYN-ACK: Absent
        .... ...0 = SYN: Absent
        [Completeness Flags: ··D···]
    [TCP Segment Len: 28]
    Sequence Number: 1    (relative sequence number)
    Sequence Number (raw): 2821470829
    [Next Sequence Number: 29    (relative sequence number)]
    Acknowledgment Number: 25    (relative ack number)
    Acknowledgment number (raw): 2785726101
    0101 .... = Header Length: 20 bytes (5)
    Flags: 0x018 (PSH, ACK)
        000. .... .... = Reserved: Not set
        ...0 .... .... = Accurate ECN: Not set
        .... 0... .... = Congestion Window Reduced: Not set
        .... .0.. .... = ECN-Echo: Not set
        .... ..0. .... = Urgent: Not set
        .... ...1 .... = Acknowledgment: Set
        .... .... 1... = Push: Set
        .... .... .0.. = Reset: Not set
        .... .... ..0. = Syn: Not set
        .... .... ...0 = Fin: Not set
        [TCP Flags: ·······AP···]
    Window: 253
    [Calculated window size: 253]
    [Window size scaling factor: -1 (unknown)]
    Checksum: 0x94a0 [unverified]
    [Checksum Status: Unverified]
    Urgent Pointer: 0
    [Timestamps]
        [Time since first frame in this TCP stream: 0.000368000 seconds]
        [Time since previous frame in this TCP stream: 0.000368000 seconds]
    [SEQ/ACK analysis]
        [This is an ACK to the segment in frame: 3]
        [The RTT to ACK the segment was: 0.000368000 seconds]
        [Bytes in flight: 28]
        [Bytes sent since last PSH flag: 28]
    TCP payload (28 bytes)
Transport Layer Security
    TLSv1.2 Record Layer: Application Data Protocol: Hypertext Transfer Protocol
        Content Type: Application Data (23)
        Version: TLS 1.2 (0x0303)
        Length: 23
        Encrypted Application Data: 359947c1c58568a775f7f6d256778d9b8dbabde049bccd
        [Application Data Protocol: Hypertext Transfer Protocol]

Frame 5: 74 bytes on wire (592 bits), 74 bytes captured (592 bits)
    Encapsulation type: Ethernet (1)
    Arrival Time: Sep 30, 2025 11:02:59.442972000 EDT
    UTC Arrival Time: Sep 30, 2025 15:02:59.442972000 UTC
    Epoch Arrival Time: 1759244579.442972000
    [Time shift for this packet: 0.000000000 seconds]
    [Time delta from previous captured frame: 0.101999000 seconds]
    [Time delta from previous displayed frame: 0.101999000 seconds]
    [Time since reference or first frame: 1.433036000 seconds]
    Frame Number: 5
    Frame Length: 74 bytes (592 bits)
    Capture Length: 74 bytes (592 bits)
    [Frame is marked: False]
    [Frame is ignored: False]
    [Protocols in frame: eth:ethertype:ipv6:tcp]
Ethernet II, Src: 2e:b4:69:6b:dd:a0 (2e:b4:69:6b:dd:a0), Dst: CloudNetwork_28:03:b3 (d8:b3:2f:28:03:b3)
    Destination: CloudNetwork_28:03:b3 (d8:b3:2f:28:03:b3)
        .... ..0. .... .... .... .... = LG bit: Globally unique address (factory default)
        .... ...0 .... .... .... .... = IG bit: Individual address (unicast)
    Source: 2e:b4:69:6b:dd:a0 (2e:b4:69:6b:dd:a0)
        .... ..1. .... .... .... .... = LG bit: Locally administered address (this is NOT the factory default)
        .... ...0 .... .... .... .... = IG bit: Individual address (unicast)
    Type: IPv6 (0x86dd)
    [Stream index: 1]
Internet Protocol Version 6, Src: 2a06:98c1:3108::ac40:94eb, Dst: 2402:3a80:4225:2b37:550b:b939:288f:d13d
    0110 .... = Version: 6
    .... 1000 1000 .... .... .... .... .... = Traffic Class: 0x88 (DSCP: AF41, ECN: Not-ECT)
        .... 1000 10.. .... .... .... .... .... = Differentiated Services Codepoint: Assured Forwarding 41 (34)
        .... .... ..00 .... .... .... .... .... = Explicit Congestion Notification: Not ECN-Capable Transport (0)
    .... 1001 1001 0000 1010 1010 = Flow Label: 0x990aa
    Payload Length: 20
    Next Header: TCP (6)
    Hop Limit: 56
    Source Address: 2a06:98c1:3108::ac40:94eb
        [Address Space: Global Unicast]
    Destination Address: 2402:3a80:4225:2b37:550b:b939:288f:d13d
        [Address Space: Global Unicast]
    [Stream index: 1]
Transmission Control Protocol, Src Port: 443, Dst Port: 51663, Seq: 25, Ack: 29, Len: 0
    Source Port: 443
    Destination Port: 51663
    [Stream index: 0]
    [Stream Packet Number: 3]
    [Conversation completeness: Incomplete (8)]
        ..0. .... = RST: Absent
        ...0 .... = FIN: Absent
        .... 1... = Data: Present
        .... .0.. = ACK: Absent
        .... ..0. = SYN-ACK: Absent
        .... ...0 = SYN: Absent
        [Completeness Flags: ··D···]
    [TCP Segment Len: 0]
    Sequence Number: 25    (relative sequence number)
    Sequence Number (raw): 2785726101
    [Next Sequence Number: 25    (relative sequence number)]
    Acknowledgment Number: 29    (relative ack number)
    Acknowledgment number (raw): 2821470857
    0101 .... = Header Length: 20 bytes (5)
    Flags: 0x010 (ACK)
        000. .... .... = Reserved: Not set
        ...0 .... .... = Accurate ECN: Not set
        .... 0... .... = Congestion Window Reduced: Not set
        .... .0.. .... = ECN-Echo: Not set
        .... ..0. .... = Urgent: Not set
        .... ...1 .... = Acknowledgment: Set
        .... .... 0... = Push: Not set
        .... .... .0.. = Reset: Not set
        .... .... ..0. = Syn: Not set
        .... .... ...0 = Fin: Not set
        [TCP Flags: ·······A····]
    Window: 19
    [Calculated window size: 19]
    [Window size scaling factor: -1 (unknown)]
    Checksum: 0x83f4 [unverified]
    [Checksum Status: Unverified]
    Urgent Pointer: 0
    [Timestamps]
        [Time since first frame in this TCP stream: 0.102367000 seconds]
        [Time since previous frame in this TCP stream: 0.101999000 seconds]
    [SEQ/ACK analysis]
        [This is an ACK to the segment in frame: 4]
        [The RTT to ACK the segment was: 0.101999000 seconds]

Frame 6: 74 bytes on wire (592 bits), 74 bytes captured (592 bits)
    Encapsulation type: Ethernet (1)
    Arrival Time: Sep 30, 2025 11:03:03.844193000 EDT
    UTC Arrival Time: Sep 30, 2025 15:03:03.844193000 UTC
    Epoch Arrival Time: 1759244583.844193000
    [Time shift for this packet: 0.000000000 seconds]
    [Time delta from previous captured frame: 4.401221000 seconds]
    [Time delta from previous displayed frame: 4.401221000 seconds]
    [Time since reference or first frame: 5.834257000 seconds]
    Frame Number: 6
    Frame Length: 74 bytes (592 bits)
    Capture Length: 74 bytes (592 bits)
    [Frame is marked: False]
    [Frame is ignored: False]
    [Protocols in frame: eth:ethertype:ipv6:tcp]
Ethernet II, Src: 2e:b4:69:6b:dd:a0 (2e:b4:69:6b:dd:a0), Dst: CloudNetwork_28:03:b3 (d8:b3:2f:28:03:b3)
    Destination: CloudNetwork_28:03:b3 (d8:b3:2f:28:03:b3)
        .... ..0. .... .... .... .... = LG bit: Globally unique address (factory default)
        .... ...0 .... .... .... .... = IG bit: Individual address (unicast)
    Source: 2e:b4:69:6b:dd:a0 (2e:b4:69:6b:dd:a0)
        .... ..1. .... .... .... .... = LG bit: Locally administered address (this is NOT the factory default)
        .... ...0 .... .... .... .... = IG bit: Individual address (unicast)
    Type: IPv6 (0x86dd)
    [Stream index: 1]
Internet Protocol Version 6, Src: 2600:1f18:24e6:b902:a46c:a4a6:87fe:c14c, Dst: 2402:3a80:4225:2b37:550b:b939:288f:d13d
    0110 .... = Version: 6
    .... 1000 1000 .... .... .... .... .... = Traffic Class: 0x88 (DSCP: AF41, ECN: Not-ECT)
        .... 1000 10.. .... .... .... .... .... = Differentiated Services Codepoint: Assured Forwarding 41 (34)
        .... .... ..00 .... .... .... .... .... = Explicit Congestion Notification: Not ECN-Capable Transport (0)
    .... 0000 0000 0000 0000 0000 = Flow Label: 0x00000
    Payload Length: 20
    Next Header: TCP (6)
    Hop Limit: 47
    Source Address: 2600:1f18:24e6:b902:a46c:a4a6:87fe:c14c
        [Address Space: Global Unicast]
    Destination Address: 2402:3a80:4225:2b37:550b:b939:288f:d13d
        [Address Space: Global Unicast]
    [Stream index: 2]
Transmission Control Protocol, Src Port: 443, Dst Port: 51698, Seq: 1, Ack: 1, Len: 0
    Source Port: 443
    Destination Port: 51698
    [Stream index: 1]
    [Stream Packet Number: 1]
    [Conversation completeness: Incomplete (0)]
        ..0. .... = RST: Absent
        ...0 .... = FIN: Absent
        .... 0... = Data: Absent
        .... .0.. = ACK: Absent
        .... ..0. = SYN-ACK: Absent
        .... ...0 = SYN: Absent
        [Completeness Flags: [ Null ]]
    [TCP Segment Len: 0]
    Sequence Number: 1    (relative sequence number)
    Sequence Number (raw): 2218075943
    [Next Sequence Number: 2    (relative sequence number)]
    Acknowledgment Number: 1    (relative ack number)
    Acknowledgment number (raw): 665446091
    0101 .... = Header Length: 20 bytes (5)
    Flags: 0x011 (FIN, ACK)
        000. .... .... = Reserved: Not set
        ...0 .... .... = Accurate ECN: Not set
        .... 0... .... = Congestion Window Reduced: Not set
        .... .0.. .... = ECN-Echo: Not set
        .... ..0. .... = Urgent: Not set
        .... ...1 .... = Acknowledgment: Set
        .... .... 0... = Push: Not set
        .... .... .0.. = Reset: Not set
        .... .... ..0. = Syn: Not set
        .... .... ...1 = Fin: Set
            [Expert Info (Chat/Sequence): Connection finish (FIN)]
                [Connection finish (FIN)]
                [Severity level: Chat]
                [Group: Sequence]
        [TCP Flags: ·······A···F]
            [Expert Info (Note/Sequence): This frame initiates the connection closing]
                [This frame initiates the connection closing]
                [Severity level: Note]
                [Group: Sequence]
    Window: 72
    [Calculated window size: 72]
    [Window size scaling factor: -1 (unknown)]
    Checksum: 0xa0bc [unverified]
    [Checksum Status: Unverified]
    Urgent Pointer: 0
    [Timestamps]
        [Time since first frame in this TCP stream: 0.000000000 seconds]
        [Time since previous frame in this TCP stream: 0.000000000 seconds]

Frame 7: 74 bytes on wire (592 bits), 74 bytes captured (592 bits)
    Encapsulation type: Ethernet (1)
    Arrival Time: Sep 30, 2025 11:03:03.844195000 EDT
    UTC Arrival Time: Sep 30, 2025 15:03:03.844195000 UTC
    Epoch Arrival Time: 1759244583.844195000
    [Time shift for this packet: 0.000000000 seconds]
    [Time delta from previous captured frame: 0.000002000 seconds]
    [Time delta from previous displayed frame: 0.000002000 seconds]
    [Time since reference or first frame: 5.834259000 seconds]
    Frame Number: 7
    Frame Length: 74 bytes (592 bits)
    Capture Length: 74 bytes (592 bits)
    [Frame is marked: False]
    [Frame is ignored: False]
    [Protocols in frame: eth:ethertype:ipv6:tcp]
Ethernet II, Src: CloudNetwork_28:03:b3 (d8:b3:2f:28:03:b3), Dst: 2e:b4:69:6b:dd:a0 (2e:b4:69:6b:dd:a0)
    Destination: 2e:b4:69:6b:dd:a0 (2e:b4:69:6b:dd:a0)
        .... ..1. .... .... .... .... = LG bit: Locally administered address (this is NOT the factory default)
        .... ...0 .... .... .... .... = IG bit: Individual address (unicast)
    Source: CloudNetwork_28:03:b3 (d8:b3:2f:28:03:b3)
        .... ..0. .... .... .... .... = LG bit: Globally unique address (factory default)
        .... ...0 .... .... .... .... = IG bit: Individual address (unicast)
    Type: IPv6 (0x86dd)
    [Stream index: 1]
Internet Protocol Version 6, Src: 2402:3a80:4225:2b37:550b:b939:288f:d13d, Dst: 2600:1f18:24e6:b902:a46c:a4a6:87fe:c14c
    0110 .... = Version: 6
    .... 0000 0000 .... .... .... .... .... = Traffic Class: 0x00 (DSCP: CS0, ECN: Not-ECT)
        .... 0000 00.. .... .... .... .... .... = Differentiated Services Codepoint: Default (0)
        .... .... ..00 .... .... .... .... .... = Explicit Congestion Notification: Not ECN-Capable Transport (0)
    .... 0111 0100 0010 0101 0011 = Flow Label: 0x74253
    Payload Length: 20
    Next Header: TCP (6)
    Hop Limit: 254
    Source Address: 2402:3a80:4225:2b37:550b:b939:288f:d13d
        [Address Space: Global Unicast]
    Destination Address: 2600:1f18:24e6:b902:a46c:a4a6:87fe:c14c
        [Address Space: Global Unicast]
    [Stream index: 2]
Transmission Control Protocol, Src Port: 51698, Dst Port: 443, Seq: 1341, Ack: 2, Len: 0
    Source Port: 51698
    Destination Port: 443
    [Stream index: 1]
    [Stream Packet Number: 2]
    [Conversation completeness: Incomplete (20)]
        ..0. .... = RST: Absent
        ...1 .... = FIN: Present
        .... 0... = Data: Absent
        .... .1.. = ACK: Present
        .... ..0. = SYN-ACK: Absent
        .... ...0 = SYN: Absent
        [Completeness Flags: ·F·A··]
    [TCP Segment Len: 0]
    Sequence Number: 1341    (relative sequence number)
    Sequence Number (raw): 665447431
    [Next Sequence Number: 1341    (relative sequence number)]
    Acknowledgment Number: 2    (relative ack number)
    Acknowledgment number (raw): 2218075944
    0101 .... = Header Length: 20 bytes (5)
    Flags: 0x010 (ACK)
        000. .... .... = Reserved: Not set
        ...0 .... .... = Accurate ECN: Not set
        .... 0... .... = Congestion Window Reduced: Not set
        .... .0.. .... = ECN-Echo: Not set
        .... ..0. .... = Urgent: Not set
        .... ...1 .... = Acknowledgment: Set
        .... .... 0... = Push: Not set
        .... .... .0.. = Reset: Not set
        .... .... ..0. = Syn: Not set
        .... .... ...0 = Fin: Not set
        [TCP Flags: ·······A····]
    Window: 252
    [Calculated window size: 252]
    [Window size scaling factor: -1 (unknown)]
    Checksum: 0x9acc [unverified]
    [Checksum Status: Unverified]
    Urgent Pointer: 0
    [Timestamps]
        [Time since first frame in this TCP stream: 0.000002000 seconds]
        [Time since previous frame in this TCP stream: 0.000002000 seconds]
    [SEQ/ACK analysis]
        [This is an ACK to the segment in frame: 6]
        [The RTT to ACK the segment was: 0.000002000 seconds]

Frame 8: 88 bytes on wire (704 bits), 88 bytes captured (704 bits)
    Encapsulation type: Ethernet (1)
    Arrival Time: Sep 30, 2025 11:03:03.846354000 EDT
    UTC Arrival Time: Sep 30, 2025 15:03:03.846354000 UTC
    Epoch Arrival Time: 1759244583.846354000
    [Time shift for this packet: 0.000000000 seconds]
    [Time delta from previous captured frame: 0.002159000 seconds]
    [Time delta from previous displayed frame: 0.002159000 seconds]
    [Time since reference or first frame: 5.836418000 seconds]
    Frame Number: 8
    Frame Length: 88 bytes (704 bits)
    Capture Length: 88 bytes (704 bits)
    [Frame is marked: False]
    [Frame is ignored: False]
    [Protocols in frame: eth:ethertype:ip:udp:dns]
Ethernet II, Src: CloudNetwork_28:03:b3 (d8:b3:2f:28:03:b3), Dst: 2e:b4:69:6b:dd:a0 (2e:b4:69:6b:dd:a0)
    Destination: 2e:b4:69:6b:dd:a0 (2e:b4:69:6b:dd:a0)
        .... ..1. .... .... .... .... = LG bit: Locally administered address (this is NOT the factory default)
        .... ...0 .... .... .... .... = IG bit: Individual address (unicast)
    Source: CloudNetwork_28:03:b3 (d8:b3:2f:28:03:b3)
        .... ..0. .... .... .... .... = LG bit: Globally unique address (factory default)
        .... ...0 .... .... .... .... = IG bit: Individual address (unicast)
    Type: IPv4 (0x0800)
    [Stream index: 1]
Internet Protocol Version 4, Src: 10.239.252.152, Dst: 10.239.252.119
    0100 .... = Version: 4
    .... 0101 = Header Length: 20 bytes (5)
    Differentiated Services Field: 0x00 (DSCP: CS0, ECN: Not-ECT)
        0000 00.. = Differentiated Services Codepoint: Default (0)
        .... ..00 = Explicit Congestion Notification: Not ECN-Capable Transport (0)
    Total Length: 74
    Identification: 0xbae6 (47846)
    000. .... = Flags: 0x0
        0... .... = Reserved bit: Not set
        .0.. .... = Don't fragment: Not set
        ..0. .... = More fragments: Not set
    ...0 0000 0000 0000 = Fragment Offset: 0
    Time to Live: 128
    Protocol: UDP (17)
    Header Checksum: 0x70ce [validation disabled]
    [Header checksum status: Unverified]
    Source Address: 10.239.252.152
    Destination Address: 10.239.252.119
    [Stream index: 0]
User Datagram Protocol, Src Port: 50273, Dst Port: 53
    Source Port: 50273
    Destination Port: 53
    Length: 54
    Checksum: 0x1cb7 [unverified]
    [Checksum Status: Unverified]
    [Stream index: 0]
    [Stream Packet Number: 1]
    [Timestamps]
        [Time since first frame: 0.000000000 seconds]
        [Time since previous frame: 0.000000000 seconds]
    UDP payload (46 bytes)
Domain Name System (query)
    Transaction ID: 0x5dec
    Flags: 0x0100 Standard query
        0... .... .... .... = Response: Message is a query
        .000 0... .... .... = Opcode: Standard query (0)
        .... ..0. .... .... = Truncated: Message is not truncated
        .... ...1 .... .... = Recursion desired: Do query recursively
        .... .... .0.. .... = Z: reserved (0)
        .... .... ...0 .... = Non-authenticated data: Unacceptable
    Questions: 1
    Answer RRs: 0
    Authority RRs: 0
    Additional RRs: 0
    Queries
        browser-intake-datadoghq.com: type AAAA, class IN
            Name: browser-intake-datadoghq.com
            [Name Length: 28]
            [Label Count: 2]
            Type: AAAA (28) (IP6 Address)
            Class: IN (0x0001)

Frame 9: 88 bytes on wire (704 bits), 88 bytes captured (704 bits)
    Encapsulation type: Ethernet (1)
    Arrival Time: Sep 30, 2025 11:03:03.846356000 EDT
    UTC Arrival Time: Sep 30, 2025 15:03:03.846356000 UTC
    Epoch Arrival Time: 1759244583.846356000
    [Time shift for this packet: 0.000000000 seconds]
    [Time delta from previous captured frame: 0.000002000 seconds]
    [Time delta from previous displayed frame: 0.000002000 seconds]
    [Time since reference or first frame: 5.836420000 seconds]
    Frame Number: 9
    Frame Length: 88 bytes (704 bits)
    Capture Length: 88 bytes (704 bits)
    [Frame is marked: False]
    [Frame is ignored: False]
    [Protocols in frame: eth:ethertype:ip:udp:dns]
Ethernet II, Src: CloudNetwork_28:03:b3 (d8:b3:2f:28:03:b3), Dst: 2e:b4:69:6b:dd:a0 (2e:b4:69:6b:dd:a0)
    Destination: 2e:b4:69:6b:dd:a0 (2e:b4:69:6b:dd:a0)
        .... ..1. .... .... .... .... = LG bit: Locally administered address (this is NOT the factory default)
        .... ...0 .... .... .... .... = IG bit: Individual address (unicast)
    Source: CloudNetwork_28:03:b3 (d8:b3:2f:28:03:b3)
        .... ..0. .... .... .... .... = LG bit: Globally unique address (factory default)
        .... ...0 .... .... .... .... = IG bit: Individual address (unicast)
    Type: IPv4 (0x0800)
    [Stream index: 1]
Internet Protocol Version 4, Src: 10.239.252.152, Dst: 10.239.252.119
    0100 .... = Version: 4
    .... 0101 = Header Length: 20 bytes (5)
    Differentiated Services Field: 0x00 (DSCP: CS0, ECN: Not-ECT)
        0000 00.. = Differentiated Services Codepoint: Default (0)
        .... ..00 = Explicit Congestion Notification: Not ECN-Capable Transport (0)
    Total Length: 74
    Identification: 0xbae7 (47847)
    000. .... = Flags: 0x0
        0... .... = Reserved bit: Not set
        .0.. .... = Don't fragment: Not set
        ..0. .... = More fragments: Not set
    ...0 0000 0000 0000 = Fragment Offset: 0
    Time to Live: 128
    Protocol: UDP (17)
    Header Checksum: 0x70cd [validation disabled]
    [Header checksum status: Unverified]
    Source Address: 10.239.252.152
    Destination Address: 10.239.252.119
    [Stream index: 0]
User Datagram Protocol, Src Port: 52513, Dst Port: 53
    Source Port: 52513
    Destination Port: 53
    Length: 54
    Checksum: 0x4446 [unverified]
    [Checksum Status: Unverified]
    [Stream index: 1]
    [Stream Packet Number: 1]
    [Timestamps]
        [Time since first frame: 0.000000000 seconds]
        [Time since previous frame: 0.000000000 seconds]
    UDP payload (46 bytes)
Domain Name System (query)
    Transaction ID: 0x2db8
    Flags: 0x0100 Standard query
        0... .... .... .... = Response: Message is a query
        .000 0... .... .... = Opcode: Standard query (0)
        .... ..0. .... .... = Truncated: Message is not truncated
        .... ...1 .... .... = Recursion desired: Do query recursively
        .... .... .0.. .... = Z: reserved (0)
        .... .... ...0 .... = Non-authenticated data: Unacceptable
    Questions: 1
    Answer RRs: 0
    Authority RRs: 0
    Additional RRs: 0
    Queries
        browser-intake-datadoghq.com: type A, class IN
            Name: browser-intake-datadoghq.com
            [Name Length: 28]
            [Label Count: 2]
            Type: A (1) (Host Address)
            Class: IN (0x0001)

Frame 10: 88 bytes on wire (704 bits), 88 bytes captured (704 bits)
    Encapsulation type: Ethernet (1)
    Arrival Time: Sep 30, 2025 11:03:03.846647000 EDT
    UTC Arrival Time: Sep 30, 2025 15:03:03.846647000 UTC
    Epoch Arrival Time: 1759244583.846647000
    [Time shift for this packet: 0.000000000 seconds]
    [Time delta from previous captured frame: 0.000291000 seconds]
    [Time delta from previous displayed frame: 0.000291000 seconds]
    [Time since reference or first frame: 5.836711000 seconds]
    Frame Number: 10
    Frame Length: 88 bytes (704 bits)
    Capture Length: 88 bytes (704 bits)
    [Frame is marked: False]
    [Frame is ignored: False]
    [Protocols in frame: eth:ethertype:ip:udp:dns]
Ethernet II, Src: CloudNetwork_28:03:b3 (d8:b3:2f:28:03:b3), Dst: 2e:b4:69:6b:dd:a0 (2e:b4:69:6b:dd:a0)
    Destination: 2e:b4:69:6b:dd:a0 (2e:b4:69:6b:dd:a0)
        .... ..1. .... .... .... .... = LG bit: Locally administered address (this is NOT the factory default)
        .... ...0 .... .... .... .... = IG bit: Individual address (unicast)
    Source: CloudNetwork_28:03:b3 (d8:b3:2f:28:03:b3)
        .... ..0. .... .... .... .... = LG bit: Globally unique address (factory default)
        .... ...0 .... .... .... .... = IG bit: Individual address (unicast)
    Type: IPv4 (0x0800)
    [Stream index: 1]
Internet Protocol Version 4, Src: 10.239.252.152, Dst: 10.239.252.119
    0100 .... = Version: 4
    .... 0101 = Header Length: 20 bytes (5)
    Differentiated Services Field: 0x00 (DSCP: CS0, ECN: Not-ECT)
        0000 00.. = Differentiated Services Codepoint: Default (0)
        .... ..00 = Explicit Congestion Notification: Not ECN-Capable Transport (0)
    Total Length: 74
    Identification: 0xbae8 (47848)
    000. .... = Flags: 0x0
        0... .... = Reserved bit: Not set
        .0.. .... = Don't fragment: Not set
        ..0. .... = More fragments: Not set
    ...0 0000 0000 0000 = Fragment Offset: 0
    Time to Live: 128
    Protocol: UDP (17)
    Header Checksum: 0x70cc [validation disabled]
    [Header checksum status: Unverified]
    Source Address: 10.239.252.152
    Destination Address: 10.239.252.119
    [Stream index: 0]
User Datagram Protocol, Src Port: 52691, Dst Port: 53
    Source Port: 52691
    Destination Port: 53
    Length: 54
    Checksum: 0xf80f [unverified]
    [Checksum Status: Unverified]
    [Stream index: 2]
    [Stream Packet Number: 1]
    [Timestamps]
        [Time since first frame: 0.000000000 seconds]
        [Time since previous frame: 0.000000000 seconds]
    UDP payload (46 bytes)
Domain Name System (query)
    Transaction ID: 0x78fc
    Flags: 0x0100 Standard query
        0... .... .... .... = Response: Message is a query
        .000 0... .... .... = Opcode: Standard query (0)
        .... ..0. .... .... = Truncated: Message is not truncated
        .... ...1 .... .... = Recursion desired: Do query recursively
        .... .... .0.. .... = Z: reserved (0)
        .... .... ...0 .... = Non-authenticated data: Unacceptable
    Questions: 1
    Answer RRs: 0
    Authority RRs: 0
    Additional RRs: 0
    Queries
        browser-intake-datadoghq.com: type HTTPS, class IN
            Name: browser-intake-datadoghq.com
            [Name Length: 28]
            [Label Count: 2]
            Type: HTTPS (65) (HTTPS Specific Service Endpoints)
            Class: IN (0x0001)

Frame 11: 841 bytes on wire (6728 bits), 841 bytes captured (6728 bits)
    Encapsulation type: Ethernet (1)
    Arrival Time: Sep 30, 2025 11:03:03.846648000 EDT
    UTC Arrival Time: Sep 30, 2025 15:03:03.846648000 UTC
    Epoch Arrival Time: 1759244583.846648000
    [Time shift for this packet: 0.000000000 seconds]
    [Time delta from previous captured frame: 0.000001000 seconds]
    [Time delta from previous displayed frame: 0.000001000 seconds]
    [Time since reference or first frame: 5.836712000 seconds]
    Frame Number: 11
    Frame Length: 841 bytes (6728 bits)
    Capture Length: 841 bytes (6728 bits)
    [Frame is marked: False]
    [Frame is ignored: False]
    [Protocols in frame: eth:ethertype:ipv6:tcp:tls]
Ethernet II, Src: CloudNetwork_28:03:b3 (d8:b3:2f:28:03:b3), Dst: 2e:b4:69:6b:dd:a0 (2e:b4:69:6b:dd:a0)
    Destination: 2e:b4:69:6b:dd:a0 (2e:b4:69:6b:dd:a0)
        .... ..1. .... .... .... .... = LG bit: Locally administered address (this is NOT the factory default)
        .... ...0 .... .... .... .... = IG bit: Individual address (unicast)
    Source: CloudNetwork_28:03:b3 (d8:b3:2f:28:03:b3)
        .... ..0. .... .... .... .... = LG bit: Globally unique address (factory default)
        .... ...0 .... .... .... .... = IG bit: Individual address (unicast)
    Type: IPv6 (0x86dd)
    [Stream index: 1]
Internet Protocol Version 6, Src: 2402:3a80:4225:2b37:550b:b939:288f:d13d, Dst: 2600:1f18:24e6:b902:a46c:a4a6:87fe:c14c
    0110 .... = Version: 6
    .... 0000 0000 .... .... .... .... .... = Traffic Class: 0x00 (DSCP: CS0, ECN: Not-ECT)
        .... 0000 00.. .... .... .... .... .... = Differentiated Services Codepoint: Default (0)
        .... .... ..00 .... .... .... .... .... = Explicit Congestion Notification: Not ECN-Capable Transport (0)
    .... 0101 0101 0011 0000 1110 = Flow Label: 0x5530e
    Payload Length: 787
    Next Header: TCP (6)
    Hop Limit: 254
    Source Address: 2402:3a80:4225:2b37:550b:b939:288f:d13d
        [Address Space: Global Unicast]
    Destination Address: 2600:1f18:24e6:b902:a46c:a4a6:87fe:c14c
        [Address Space: Global Unicast]
    [Stream index: 2]
Transmission Control Protocol, Src Port: 51699, Dst Port: 443, Seq: 1, Ack: 1, Len: 767
    Source Port: 51699
    Destination Port: 443
    [Stream index: 2]
    [Stream Packet Number: 1]
    [Conversation completeness: Incomplete (0)]
        ..0. .... = RST: Absent
        ...0 .... = FIN: Absent
        .... 0... = Data: Absent
        .... .0.. = ACK: Absent
        .... ..0. = SYN-ACK: Absent
        .... ...0 = SYN: Absent
        [Completeness Flags: [ Null ]]
    [TCP Segment Len: 767]
    Sequence Number: 1    (relative sequence number)
    Sequence Number (raw): 1149511772
    [Next Sequence Number: 768    (relative sequence number)]
    Acknowledgment Number: 1    (relative ack number)
    Acknowledgment number (raw): 2083012311
    0101 .... = Header Length: 20 bytes (5)
    Flags: 0x018 (PSH, ACK)
        000. .... .... = Reserved: Not set
        ...0 .... .... = Accurate ECN: Not set
        .... 0... .... = Congestion Window Reduced: Not set
        .... .0.. .... = ECN-Echo: Not set
        .... ..0. .... = Urgent: Not set
        .... ...1 .... = Acknowledgment: Set
        .... .... 1... = Push: Set
        .... .... .0.. = Reset: Not set
