Real-time network capture
Duration: 30s
Files:
results/defensive_monitoring/run10/run10_network.pcap
results/defensive_monitoring/run10/run10_network_summary.txt

Summary:
Frame 1: 106 bytes on wire (848 bits), 106 bytes captured (848 bits)
    Encapsulation type: Ethernet (1)
    Arrival Time: Oct  8, 2025 00:41:57.991952000 EDT
    UTC Arrival Time: Oct  8, 2025 04:41:57.991952000 UTC
    Epoch Arrival Time: 1759898517.991952000
    [Time shift for this packet: 0.000000000 seconds]
    [Time delta from previous captured frame: 0.000000000 seconds]
    [Time delta from previous displayed frame: 0.000000000 seconds]
    [Time since reference or first frame: 0.000000000 seconds]
    Frame Number: 1
    Frame Length: 106 bytes (848 bits)
    Capture Length: 106 bytes (848 bits)
    [Frame is marked: False]
    [Frame is ignored: False]
    [Protocols in frame: eth:ethertype:ipv6:udp:dns]
Ethernet II, Src: CloudNetwork_28:03:b3 (d8:b3:2f:28:03:b3), Dst: 2e:b4:69:6b:dd:a0 (2e:b4:69:6b:dd:a0)
    Destination: 2e:b4:69:6b:dd:a0 (2e:b4:69:6b:dd:a0)
        .... ..1. .... .... .... .... = LG bit: Locally administered address (this is NOT the factory default)
        .... ...0 .... .... .... .... = IG bit: Individual address (unicast)
    Source: CloudNetwork_28:03:b3 (d8:b3:2f:28:03:b3)
        .... ..0. .... .... .... .... = LG bit: Globally unique address (factory default)
        .... ...0 .... .... .... .... = IG bit: Individual address (unicast)
    Type: IPv6 (0x86dd)
    [Stream index: 0]
Internet Protocol Version 6, Src: 2402:3a80:1e0d:5b9a:3004:d403:d45b:e140, Dst: 2402:3a80:1e0d:5b9a::a2
    0110 .... = Version: 6
    .... 0000 0000 .... .... .... .... .... = Traffic Class: 0x00 (DSCP: CS0, ECN: Not-ECT)
        .... 0000 00.. .... .... .... .... .... = Differentiated Services Codepoint: Default (0)
        .... .... ..00 .... .... .... .... .... = Explicit Congestion Notification: Not ECN-Capable Transport (0)
    .... 0111 0010 1110 1010 0010 = Flow Label: 0x72ea2
    Payload Length: 52
    Next Header: UDP (17)
    Hop Limit: 254
    Source Address: 2402:3a80:1e0d:5b9a:3004:d403:d45b:e140
        [Address Space: Global Unicast]
    Destination Address: 2402:3a80:1e0d:5b9a::a2
        [Address Space: Global Unicast]
    [Stream index: 0]
User Datagram Protocol, Src Port: 62568, Dst Port: 53
    Source Port: 62568
    Destination Port: 53
    Length: 52
    Checksum: 0xf412 [unverified]
    [Checksum Status: Unverified]
    [Stream index: 0]
    [Stream Packet Number: 1]
    [Timestamps]
        [Time since first frame: 0.000000000 seconds]
        [Time since previous frame: 0.000000000 seconds]
    UDP payload (44 bytes)
Domain Name System (query)
    Transaction ID: 0x2ad8
    Flags: 0x0100 Standard query
        0... .... .... .... = Response: Message is a query
        .000 0... .... .... = Opcode: Standard query (0)
        .... ..0. .... .... = Truncated: Message is not truncated
        .... ...1 .... .... = Recursion desired: Do query recursively
        .... .... .0.. .... = Z: reserved (0)
        .... .... ...0 .... = Non-authenticated data: Unacceptable
    Questions: 1
    Answer RRs: 0
    Authority RRs: 0
    Additional RRs: 0
    Queries
        config.teams.microsoft.com: type AAAA, class IN
            Name: config.teams.microsoft.com
            [Name Length: 26]
            [Label Count: 4]
            Type: AAAA (28) (IP6 Address)
            Class: IN (0x0001)

Frame 2: 106 bytes on wire (848 bits), 106 bytes captured (848 bits)
    Encapsulation type: Ethernet (1)
    Arrival Time: Oct  8, 2025 00:41:57.991954000 EDT
    UTC Arrival Time: Oct  8, 2025 04:41:57.991954000 UTC
    Epoch Arrival Time: 1759898517.991954000
    [Time shift for this packet: 0.000000000 seconds]
    [Time delta from previous captured frame: 0.000002000 seconds]
    [Time delta from previous displayed frame: 0.000002000 seconds]
    [Time since reference or first frame: 0.000002000 seconds]
    Frame Number: 2
    Frame Length: 106 bytes (848 bits)
    Capture Length: 106 bytes (848 bits)
    [Frame is marked: False]
    [Frame is ignored: False]
    [Protocols in frame: eth:ethertype:ipv6:udp:dns]
Ethernet II, Src: CloudNetwork_28:03:b3 (d8:b3:2f:28:03:b3), Dst: 2e:b4:69:6b:dd:a0 (2e:b4:69:6b:dd:a0)
    Destination: 2e:b4:69:6b:dd:a0 (2e:b4:69:6b:dd:a0)
        .... ..1. .... .... .... .... = LG bit: Locally administered address (this is NOT the factory default)
        .... ...0 .... .... .... .... = IG bit: Individual address (unicast)
    Source: CloudNetwork_28:03:b3 (d8:b3:2f:28:03:b3)
        .... ..0. .... .... .... .... = LG bit: Globally unique address (factory default)
        .... ...0 .... .... .... .... = IG bit: Individual address (unicast)
    Type: IPv6 (0x86dd)
    [Stream index: 0]
Internet Protocol Version 6, Src: 2402:3a80:1e0d:5b9a:3004:d403:d45b:e140, Dst: 2402:3a80:1e0d:5b9a::a2
    0110 .... = Version: 6
    .... 0000 0000 .... .... .... .... .... = Traffic Class: 0x00 (DSCP: CS0, ECN: Not-ECT)
        .... 0000 00.. .... .... .... .... .... = Differentiated Services Codepoint: Default (0)
        .... .... ..00 .... .... .... .... .... = Explicit Congestion Notification: Not ECN-Capable Transport (0)
    .... 1010 0001 1000 1110 0100 = Flow Label: 0xa18e4
    Payload Length: 52
    Next Header: UDP (17)
    Hop Limit: 254
    Source Address: 2402:3a80:1e0d:5b9a:3004:d403:d45b:e140
        [Address Space: Global Unicast]
    Destination Address: 2402:3a80:1e0d:5b9a::a2
        [Address Space: Global Unicast]
    [Stream index: 0]
User Datagram Protocol, Src Port: 64671, Dst Port: 53
    Source Port: 64671
    Destination Port: 53
    Length: 52
    Checksum: 0x2080 [unverified]
    [Checksum Status: Unverified]
    [Stream index: 1]
    [Stream Packet Number: 1]
    [Timestamps]
        [Time since first frame: 0.000000000 seconds]
        [Time since previous frame: 0.000000000 seconds]
    UDP payload (44 bytes)
Domain Name System (query)
    Transaction ID: 0xf64e
    Flags: 0x0100 Standard query
        0... .... .... .... = Response: Message is a query
        .000 0... .... .... = Opcode: Standard query (0)
        .... ..0. .... .... = Truncated: Message is not truncated
        .... ...1 .... .... = Recursion desired: Do query recursively
        .... .... .0.. .... = Z: reserved (0)
        .... .... ...0 .... = Non-authenticated data: Unacceptable
    Questions: 1
    Answer RRs: 0
    Authority RRs: 0
    Additional RRs: 0
    Queries
        config.teams.microsoft.com: type A, class IN
            Name: config.teams.microsoft.com
            [Name Length: 26]
            [Label Count: 4]
            Type: A (1) (Host Address)
            Class: IN (0x0001)

Frame 3: 106 bytes on wire (848 bits), 106 bytes captured (848 bits)
    Encapsulation type: Ethernet (1)
    Arrival Time: Oct  8, 2025 00:41:57.991954000 EDT
    UTC Arrival Time: Oct  8, 2025 04:41:57.991954000 UTC
    Epoch Arrival Time: 1759898517.991954000
    [Time shift for this packet: 0.000000000 seconds]
    [Time delta from previous captured frame: 0.000000000 seconds]
    [Time delta from previous displayed frame: 0.000000000 seconds]
    [Time since reference or first frame: 0.000002000 seconds]
    Frame Number: 3
    Frame Length: 106 bytes (848 bits)
    Capture Length: 106 bytes (848 bits)
    [Frame is marked: False]
    [Frame is ignored: False]
    [Protocols in frame: eth:ethertype:ipv6:udp:dns]
Ethernet II, Src: CloudNetwork_28:03:b3 (d8:b3:2f:28:03:b3), Dst: 2e:b4:69:6b:dd:a0 (2e:b4:69:6b:dd:a0)
    Destination: 2e:b4:69:6b:dd:a0 (2e:b4:69:6b:dd:a0)
        .... ..1. .... .... .... .... = LG bit: Locally administered address (this is NOT the factory default)
        .... ...0 .... .... .... .... = IG bit: Individual address (unicast)
    Source: CloudNetwork_28:03:b3 (d8:b3:2f:28:03:b3)
        .... ..0. .... .... .... .... = LG bit: Globally unique address (factory default)
        .... ...0 .... .... .... .... = IG bit: Individual address (unicast)
    Type: IPv6 (0x86dd)
    [Stream index: 0]
Internet Protocol Version 6, Src: 2402:3a80:1e0d:5b9a:3004:d403:d45b:e140, Dst: 2402:3a80:1e0d:5b9a::a2
    0110 .... = Version: 6
    .... 0000 0000 .... .... .... .... .... = Traffic Class: 0x00 (DSCP: CS0, ECN: Not-ECT)
        .... 0000 00.. .... .... .... .... .... = Differentiated Services Codepoint: Default (0)
        .... .... ..00 .... .... .... .... .... = Explicit Congestion Notification: Not ECN-Capable Transport (0)
    .... 1110 0001 0110 1001 1110 = Flow Label: 0xe169e
    Payload Length: 52
    Next Header: UDP (17)
    Hop Limit: 254
    Source Address: 2402:3a80:1e0d:5b9a:3004:d403:d45b:e140
        [Address Space: Global Unicast]
    Destination Address: 2402:3a80:1e0d:5b9a::a2
        [Address Space: Global Unicast]
    [Stream index: 0]
User Datagram Protocol, Src Port: 51503, Dst Port: 53
    Source Port: 51503
    Destination Port: 53
    Length: 52
    Checksum: 0x386d [unverified]
    [Checksum Status: Unverified]
    [Stream index: 2]
    [Stream Packet Number: 1]
    [Timestamps]
        [Time since first frame: 0.000000000 seconds]
        [Time since previous frame: 0.000000000 seconds]
    UDP payload (44 bytes)
Domain Name System (query)
    Transaction ID: 0x1192
    Flags: 0x0100 Standard query
        0... .... .... .... = Response: Message is a query
        .000 0... .... .... = Opcode: Standard query (0)
        .... ..0. .... .... = Truncated: Message is not truncated
        .... ...1 .... .... = Recursion desired: Do query recursively
        .... .... .0.. .... = Z: reserved (0)
        .... .... ...0 .... = Non-authenticated data: Unacceptable
    Questions: 1
    Answer RRs: 0
    Authority RRs: 0
    Additional RRs: 0
    Queries
        config.teams.microsoft.com: type HTTPS, class IN
            Name: config.teams.microsoft.com
            [Name Length: 26]
            [Label Count: 4]
            Type: HTTPS (65) (HTTPS Specific Service Endpoints)
            Class: IN (0x0001)

Frame 4: 291 bytes on wire (2328 bits), 291 bytes captured (2328 bits)
    Encapsulation type: Ethernet (1)
    Arrival Time: Oct  8, 2025 00:41:58.234131000 EDT
    UTC Arrival Time: Oct  8, 2025 04:41:58.234131000 UTC
    Epoch Arrival Time: 1759898518.234131000
    [Time shift for this packet: 0.000000000 seconds]
    [Time delta from previous captured frame: 0.242177000 seconds]
    [Time delta from previous displayed frame: 0.242177000 seconds]
    [Time since reference or first frame: 0.242179000 seconds]
    Frame Number: 4
    Frame Length: 291 bytes (2328 bits)
    Capture Length: 291 bytes (2328 bits)
    [Frame is marked: False]
    [Frame is ignored: False]
    [Protocols in frame: eth:ethertype:ipv6:udp:dns]
Ethernet II, Src: 2e:b4:69:6b:dd:a0 (2e:b4:69:6b:dd:a0), Dst: CloudNetwork_28:03:b3 (d8:b3:2f:28:03:b3)
    Destination: CloudNetwork_28:03:b3 (d8:b3:2f:28:03:b3)
        .... ..0. .... .... .... .... = LG bit: Globally unique address (factory default)
        .... ...0 .... .... .... .... = IG bit: Individual address (unicast)
    Source: 2e:b4:69:6b:dd:a0 (2e:b4:69:6b:dd:a0)
        .... ..1. .... .... .... .... = LG bit: Locally administered address (this is NOT the factory default)
        .... ...0 .... .... .... .... = IG bit: Individual address (unicast)
    Type: IPv6 (0x86dd)
    [Stream index: 0]
Internet Protocol Version 6, Src: 2402:3a80:1e0d:5b9a::a2, Dst: 2402:3a80:1e0d:5b9a:3004:d403:d45b:e140
    0110 .... = Version: 6
    .... 0000 0000 .... .... .... .... .... = Traffic Class: 0x00 (DSCP: CS0, ECN: Not-ECT)
        .... 0000 00.. .... .... .... .... .... = Differentiated Services Codepoint: Default (0)
        .... .... ..00 .... .... .... .... .... = Explicit Congestion Notification: Not ECN-Capable Transport (0)
    .... 0001 0101 1110 0100 1010 = Flow Label: 0x15e4a
    Payload Length: 237
    Next Header: UDP (17)
    Hop Limit: 64
    Source Address: 2402:3a80:1e0d:5b9a::a2
        [Address Space: Global Unicast]
    Destination Address: 2402:3a80:1e0d:5b9a:3004:d403:d45b:e140
        [Address Space: Global Unicast]
    [Stream index: 0]
User Datagram Protocol, Src Port: 53, Dst Port: 51503
    Source Port: 53
    Destination Port: 51503
    Length: 237
    Checksum: 0xa2ef [unverified]
    [Checksum Status: Unverified]
    [Stream index: 2]
    [Stream Packet Number: 2]
    [Timestamps]
        [Time since first frame: 0.242177000 seconds]
        [Time since previous frame: 0.242177000 seconds]
    UDP payload (229 bytes)
Domain Name System (response)
    Transaction ID: 0x1192
    Flags: 0x8180 Standard query response, No error
        1... .... .... .... = Response: Message is a response
        .000 0... .... .... = Opcode: Standard query (0)
        .... .0.. .... .... = Authoritative: Server is not an authority for domain
        .... ..0. .... .... = Truncated: Message is not truncated
        .... ...1 .... .... = Recursion desired: Do query recursively
        .... .... 1... .... = Recursion available: Server can do recursive queries
        .... .... .0.. .... = Z: reserved (0)
        .... .... ..0. .... = Answer authenticated: Answer/authority portion was not authenticated by the server
        .... .... ...0 .... = Non-authenticated data: Unacceptable
        .... .... .... 0000 = Reply code: No error (0)
    Questions: 1
    Answer RRs: 3
    Authority RRs: 1
    Additional RRs: 0
    Queries
        config.teams.microsoft.com: type HTTPS, class IN
            Name: config.teams.microsoft.com
            [Name Length: 26]
            [Label Count: 4]
            Type: HTTPS (65) (HTTPS Specific Service Endpoints)
            Class: IN (0x0001)
    Answers
        config.teams.microsoft.com: type CNAME, class IN, cname config.teams.trafficmanager.net
            Name: config.teams.microsoft.com
            Type: CNAME (5) (Canonical NAME for an alias)
            Class: IN (0x0001)
            Time to live: 2830 (47 minutes, 10 seconds)
            Data length: 33
            CNAME: config.teams.trafficmanager.net
        config.teams.trafficmanager.net: type CNAME, class IN, cname dual-s-0005-teams.config.skype.com
            Name: config.teams.trafficmanager.net
            Type: CNAME (5) (Canonical NAME for an alias)
            Class: IN (0x0001)
            Time to live: 47 (47 seconds)
            Data length: 33
            CNAME: dual-s-0005-teams.config.skype.com
        dual-s-0005-teams.config.skype.com: type CNAME, class IN, cname config-teams.s-0005.dual-s-msedge.net
            Name: dual-s-0005-teams.config.skype.com
            Type: CNAME (5) (Canonical NAME for an alias)
            Class: IN (0x0001)
            Time to live: 6259 (1 hour, 44 minutes, 19 seconds)
            Data length: 36
            CNAME: config-teams.s-0005.dual-s-msedge.net
    Authoritative nameservers
        dual-s-msedge.net: type SOA, class IN, mname ns1.dual-s-msedge.net
            Name: dual-s-msedge.net
            Type: SOA (6) (Start Of a zone of Authority)
            Class: IN (0x0001)
            Time to live: 70 (1 minute, 10 seconds)
            Data length: 35
            Primary name server: ns1.dual-s-msedge.net
            Responsible authority's mailbox: msnhst.microsoft.com
            Serial Number: 2016060801
            Refresh Interval: 1800 (30 minutes)
            Retry Interval: 900 (15 minutes)
            Expire limit: 2419200 (28 days)
            Minimum TTL: 240 (4 minutes)
    [Request In: 3]
    [Time: 0.242177000 seconds]

Frame 5: 314 bytes on wire (2512 bits), 314 bytes captured (2512 bits)
    Encapsulation type: Ethernet (1)
    Arrival Time: Oct  8, 2025 00:41:58.234134000 EDT
    UTC Arrival Time: Oct  8, 2025 04:41:58.234134000 UTC
    Epoch Arrival Time: 1759898518.234134000
    [Time shift for this packet: 0.000000000 seconds]
    [Time delta from previous captured frame: 0.000003000 seconds]
    [Time delta from previous displayed frame: 0.000003000 seconds]
    [Time since reference or first frame: 0.242182000 seconds]
    Frame Number: 5
    Frame Length: 314 bytes (2512 bits)
    Capture Length: 314 bytes (2512 bits)
    [Frame is marked: False]
    [Frame is ignored: False]
    [Protocols in frame: eth:ethertype:ipv6:udp:dns]
Ethernet II, Src: 2e:b4:69:6b:dd:a0 (2e:b4:69:6b:dd:a0), Dst: CloudNetwork_28:03:b3 (d8:b3:2f:28:03:b3)
    Destination: CloudNetwork_28:03:b3 (d8:b3:2f:28:03:b3)
        .... ..0. .... .... .... .... = LG bit: Globally unique address (factory default)
        .... ...0 .... .... .... .... = IG bit: Individual address (unicast)
    Source: 2e:b4:69:6b:dd:a0 (2e:b4:69:6b:dd:a0)
        .... ..1. .... .... .... .... = LG bit: Locally administered address (this is NOT the factory default)
        .... ...0 .... .... .... .... = IG bit: Individual address (unicast)
    Type: IPv6 (0x86dd)
    [Stream index: 0]
Internet Protocol Version 6, Src: 2402:3a80:1e0d:5b9a::a2, Dst: 2402:3a80:1e0d:5b9a:3004:d403:d45b:e140
    0110 .... = Version: 6
    .... 0000 0000 .... .... .... .... .... = Traffic Class: 0x00 (DSCP: CS0, ECN: Not-ECT)
        .... 0000 00.. .... .... .... .... .... = Differentiated Services Codepoint: Default (0)
        .... .... ..00 .... .... .... .... .... = Explicit Congestion Notification: Not ECN-Capable Transport (0)
    .... 1111 0101 1111 1001 1100 = Flow Label: 0xf5f9c
    Payload Length: 260
    Next Header: UDP (17)
    Hop Limit: 64
    Source Address: 2402:3a80:1e0d:5b9a::a2
        [Address Space: Global Unicast]
    Destination Address: 2402:3a80:1e0d:5b9a:3004:d403:d45b:e140
        [Address Space: Global Unicast]
    [Stream index: 0]
User Datagram Protocol, Src Port: 53, Dst Port: 62568
    Source Port: 53
    Destination Port: 62568
    Length: 260
    Checksum: 0xa2d1 [unverified]
    [Checksum Status: Unverified]
    [Stream index: 0]
    [Stream Packet Number: 2]
    [Timestamps]
        [Time since first frame: 0.242182000 seconds]
        [Time since previous frame: 0.242182000 seconds]
    UDP payload (252 bytes)
Domain Name System (response)
    Transaction ID: 0x2ad8
    Flags: 0x8180 Standard query response, No error
        1... .... .... .... = Response: Message is a response
        .000 0... .... .... = Opcode: Standard query (0)
        .... .0.. .... .... = Authoritative: Server is not an authority for domain
        .... ..0. .... .... = Truncated: Message is not truncated
        .... ...1 .... .... = Recursion desired: Do query recursively
        .... .... 1... .... = Recursion available: Server can do recursive queries
        .... .... .0.. .... = Z: reserved (0)
        .... .... ..0. .... = Answer authenticated: Answer/authority portion was not authenticated by the server
        .... .... ...0 .... = Non-authenticated data: Unacceptable
        .... .... .... 0000 = Reply code: No error (0)
    Questions: 1
    Answer RRs: 6
    Authority RRs: 0
    Additional RRs: 0
    Queries
        config.teams.microsoft.com: type AAAA, class IN
            Name: config.teams.microsoft.com
            [Name Length: 26]
            [Label Count: 4]
            Type: AAAA (28) (IP6 Address)
            Class: IN (0x0001)
    Answers
        config.teams.microsoft.com: type CNAME, class IN, cname config.teams.trafficmanager.net
            Name: config.teams.microsoft.com
            Type: CNAME (5) (Canonical NAME for an alias)
            Class: IN (0x0001)
            Time to live: 2830 (47 minutes, 10 seconds)
            Data length: 33
            CNAME: config.teams.trafficmanager.net
        config.teams.trafficmanager.net: type CNAME, class IN, cname dual-s-0005-teams.config.skype.com
            Name: config.teams.trafficmanager.net
            Type: CNAME (5) (Canonical NAME for an alias)
            Class: IN (0x0001)
            Time to live: 47 (47 seconds)
            Data length: 33
            CNAME: dual-s-0005-teams.config.skype.com
        dual-s-0005-teams.config.skype.com: type CNAME, class IN, cname config-teams.s-0005.dual-s-msedge.net
            Name: dual-s-0005-teams.config.skype.com
            Type: CNAME (5) (Canonical NAME for an alias)
            Class: IN (0x0001)
            Time to live: 6259 (1 hour, 44 minutes, 19 seconds)
            Data length: 36
            CNAME: config-teams.s-0005.dual-s-msedge.net
        config-teams.s-0005.dual-s-msedge.net: type CNAME, class IN, cname s-0005.dual-s-msedge.net
            Name: config-teams.s-0005.dual-s-msedge.net
            Type: CNAME (5) (Canonical NAME for an alias)
            Class: IN (0x0001)
            Time to live: 202 (3 minutes, 22 seconds)
            Data length: 2
            CNAME: s-0005.dual-s-msedge.net
        s-0005.dual-s-msedge.net: type AAAA, class IN, addr 2603:1063:27:2::14
            Name: s-0005.dual-s-msedge.net
            Type: AAAA (28) (IP6 Address)
            Class: IN (0x0001)
            Time to live: 24 (24 seconds)
            Data length: 16
            AAAA Address: 2603:1063:27:2::14
        s-0005.dual-s-msedge.net: type AAAA, class IN, addr 2603:1063:27:1::14
            Name: s-0005.dual-s-msedge.net
            Type: AAAA (28) (IP6 Address)
            Class: IN (0x0001)
            Time to live: 24 (24 seconds)
            Data length: 16
            AAAA Address: 2603:1063:27:1::14
    [Request In: 1]
    [Time: 0.242182000 seconds]

Frame 6: 290 bytes on wire (2320 bits), 290 bytes captured (2320 bits)
    Encapsulation type: Ethernet (1)
    Arrival Time: Oct  8, 2025 00:41:58.234134000 EDT
    UTC Arrival Time: Oct  8, 2025 04:41:58.234134000 UTC
    Epoch Arrival Time: 1759898518.234134000
    [Time shift for this packet: 0.000000000 seconds]
    [Time delta from previous captured frame: 0.000000000 seconds]
    [Time delta from previous displayed frame: 0.000000000 seconds]
    [Time since reference or first frame: 0.242182000 seconds]
    Frame Number: 6
    Frame Length: 290 bytes (2320 bits)
    Capture Length: 290 bytes (2320 bits)
    [Frame is marked: False]
    [Frame is ignored: False]
    [Protocols in frame: eth:ethertype:ipv6:udp:dns]
Ethernet II, Src: 2e:b4:69:6b:dd:a0 (2e:b4:69:6b:dd:a0), Dst: CloudNetwork_28:03:b3 (d8:b3:2f:28:03:b3)
    Destination: CloudNetwork_28:03:b3 (d8:b3:2f:28:03:b3)
        .... ..0. .... .... .... .... = LG bit: Globally unique address (factory default)
        .... ...0 .... .... .... .... = IG bit: Individual address (unicast)
    Source: 2e:b4:69:6b:dd:a0 (2e:b4:69:6b:dd:a0)
        .... ..1. .... .... .... .... = LG bit: Locally administered address (this is NOT the factory default)
        .... ...0 .... .... .... .... = IG bit: Individual address (unicast)
    Type: IPv6 (0x86dd)
    [Stream index: 0]
Internet Protocol Version 6, Src: 2402:3a80:1e0d:5b9a::a2, Dst: 2402:3a80:1e0d:5b9a:3004:d403:d45b:e140
    0110 .... = Version: 6
    .... 0000 0000 .... .... .... .... .... = Traffic Class: 0x00 (DSCP: CS0, ECN: Not-ECT)
        .... 0000 00.. .... .... .... .... .... = Differentiated Services Codepoint: Default (0)
        .... .... ..00 .... .... .... .... .... = Explicit Congestion Notification: Not ECN-Capable Transport (0)
    .... 1010 0010 1010 0100 0110 = Flow Label: 0xa2a46
    Payload Length: 236
    Next Header: UDP (17)
    Hop Limit: 64
    Source Address: 2402:3a80:1e0d:5b9a::a2
        [Address Space: Global Unicast]
    Destination Address: 2402:3a80:1e0d:5b9a:3004:d403:d45b:e140
        [Address Space: Global Unicast]
    [Stream index: 0]
User Datagram Protocol, Src Port: 53, Dst Port: 64671
    Source Port: 53
    Destination Port: 64671
    Length: 236
    Checksum: 0xd13e [unverified]
    [Checksum Status: Unverified]
    [Stream index: 1]
    [Stream Packet Number: 2]
    [Timestamps]
        [Time since first frame: 0.242180000 seconds]
        [Time since previous frame: 0.242180000 seconds]
    UDP payload (228 bytes)
Domain Name System (response)
    Transaction ID: 0xf64e
    Flags: 0x8180 Standard query response, No error
        1... .... .... .... = Response: Message is a response
        .000 0... .... .... = Opcode: Standard query (0)
        .... .0.. .... .... = Authoritative: Server is not an authority for domain
        .... ..0. .... .... = Truncated: Message is not truncated
        .... ...1 .... .... = Recursion desired: Do query recursively
        .... .... 1... .... = Recursion available: Server can do recursive queries
        .... .... .0.. .... = Z: reserved (0)
        .... .... ..0. .... = Answer authenticated: Answer/authority portion was not authenticated by the server
        .... .... ...0 .... = Non-authenticated data: Unacceptable
        .... .... .... 0000 = Reply code: No error (0)
    Questions: 1
    Answer RRs: 6
    Authority RRs: 0
    Additional RRs: 0
    Queries
        config.teams.microsoft.com: type A, class IN
            Name: config.teams.microsoft.com
            [Name Length: 26]
            [Label Count: 4]
            Type: A (1) (Host Address)
            Class: IN (0x0001)
    Answers
        config.teams.microsoft.com: type CNAME, class IN, cname config.teams.trafficmanager.net
            Name: config.teams.microsoft.com
            Type: CNAME (5) (Canonical NAME for an alias)
            Class: IN (0x0001)
            Time to live: 2830 (47 minutes, 10 seconds)
            Data length: 33
            CNAME: config.teams.trafficmanager.net
        config.teams.trafficmanager.net: type CNAME, class IN, cname dual-s-0005-teams.config.skype.com
            Name: config.teams.trafficmanager.net
            Type: CNAME (5) (Canonical NAME for an alias)
            Class: IN (0x0001)
            Time to live: 47 (47 seconds)
            Data length: 33
            CNAME: dual-s-0005-teams.config.skype.com
        dual-s-0005-teams.config.skype.com: type CNAME, class IN, cname config-teams.s-0005.dual-s-msedge.net
            Name: dual-s-0005-teams.config.skype.com
            Type: CNAME (5) (Canonical NAME for an alias)
            Class: IN (0x0001)
            Time to live: 6259 (1 hour, 44 minutes, 19 seconds)
            Data length: 36
            CNAME: config-teams.s-0005.dual-s-msedge.net
        config-teams.s-0005.dual-s-msedge.net: type CNAME, class IN, cname s-0005.dual-s-msedge.net
            Name: config-teams.s-0005.dual-s-msedge.net
            Type: CNAME (5) (Canonical NAME for an alias)
            Class: IN (0x0001)
            Time to live: 202 (3 minutes, 22 seconds)
            Data length: 2
            CNAME: s-0005.dual-s-msedge.net
        s-0005.dual-s-msedge.net: type A, class IN, addr 52.123.128.14
            Name: s-0005.dual-s-msedge.net
            Type: A (1) (Host Address)
            Class: IN (0x0001)
            Time to live: 240 (4 minutes)
            Data length: 4
            Address: 52.123.128.14
        s-0005.dual-s-msedge.net: type A, class IN, addr 52.123.129.14
            Name: s-0005.dual-s-msedge.net
            Type: A (1) (Host Address)
            Class: IN (0x0001)
            Time to live: 240 (4 minutes)
            Data length: 4
            Address: 52.123.129.14
    [Request In: 2]
    [Time: 0.242180000 seconds]

Frame 7: 86 bytes on wire (688 bits), 86 bytes captured (688 bits)
    Encapsulation type: Ethernet (1)
    Arrival Time: Oct  8, 2025 00:41:58.235449000 EDT
    UTC Arrival Time: Oct  8, 2025 04:41:58.235449000 UTC
    Epoch Arrival Time: 1759898518.235449000
    [Time shift for this packet: 0.000000000 seconds]
    [Time delta from previous captured frame: 0.001315000 seconds]
    [Time delta from previous displayed frame: 0.001315000 seconds]
    [Time since reference or first frame: 0.243497000 seconds]
    Frame Number: 7
    Frame Length: 86 bytes (688 bits)
    Capture Length: 86 bytes (688 bits)
    [Frame is marked: False]
    [Frame is ignored: False]
    [Protocols in frame: eth:ethertype:ipv6:tcp]
Ethernet II, Src: CloudNetwork_28:03:b3 (d8:b3:2f:28:03:b3), Dst: 2e:b4:69:6b:dd:a0 (2e:b4:69:6b:dd:a0)
    Destination: 2e:b4:69:6b:dd:a0 (2e:b4:69:6b:dd:a0)
        .... ..1. .... .... .... .... = LG bit: Locally administered address (this is NOT the factory default)
        .... ...0 .... .... .... .... = IG bit: Individual address (unicast)
    Source: CloudNetwork_28:03:b3 (d8:b3:2f:28:03:b3)
        .... ..0. .... .... .... .... = LG bit: Globally unique address (factory default)
        .... ...0 .... .... .... .... = IG bit: Individual address (unicast)
    Type: IPv6 (0x86dd)
    [Stream index: 0]
Internet Protocol Version 6, Src: 2402:3a80:1e0d:5b9a:3004:d403:d45b:e140, Dst: 2603:1063:27:2::14
    0110 .... = Version: 6
    .... 0000 0000 .... .... .... .... .... = Traffic Class: 0x00 (DSCP: CS0, ECN: Not-ECT)
        .... 0000 00.. .... .... .... .... .... = Differentiated Services Codepoint: Default (0)
        .... .... ..00 .... .... .... .... .... = Explicit Congestion Notification: Not ECN-Capable Transport (0)
    .... 0111 0111 0000 0101 1111 = Flow Label: 0x7705f
    Payload Length: 32
    Next Header: TCP (6)
    Hop Limit: 254
    Source Address: 2402:3a80:1e0d:5b9a:3004:d403:d45b:e140
        [Address Space: Global Unicast]
    Destination Address: 2603:1063:27:2::14
        [Address Space: Global Unicast]
    [Stream index: 1]
Transmission Control Protocol, Src Port: 61017, Dst Port: 443, Seq: 0, Len: 0
    Source Port: 61017
    Destination Port: 443
    [Stream index: 0]
    [Stream Packet Number: 1]
    [Conversation completeness: Incomplete (0)]
        ..0. .... = RST: Absent
        ...0 .... = FIN: Absent
        .... 0... = Data: Absent
        .... .0.. = ACK: Absent
        .... ..0. = SYN-ACK: Absent
        .... ...0 = SYN: Absent
        [Completeness Flags: [ Null ]]
    [TCP Segment Len: 0]
    Sequence Number: 0    (relative sequence number)
    Sequence Number (raw): 1754892566
    [Next Sequence Number: 1    (relative sequence number)]
    Acknowledgment Number: 0
    Acknowledgment number (raw): 0
    1000 .... = Header Length: 32 bytes (8)
    Flags: 0x002 (SYN)
        000. .... .... = Reserved: Not set
        ...0 .... .... = Accurate ECN: Not set
        .... 0... .... = Congestion Window Reduced: Not set
        .... .0.. .... = ECN-Echo: Not set
        .... ..0. .... = Urgent: Not set
        .... ...0 .... = Acknowledgment: Not set
        .... .... 0... = Push: Not set
        .... .... .0.. = Reset: Not set
        .... .... ..1. = Syn: Set
            [Expert Info (Chat/Sequence): Connection establish request (SYN): server port 443]
                [Connection establish request (SYN): server port 443]
                [Severity level: Chat]
                [Group: Sequence]
        .... .... ...0 = Fin: Not set
        [TCP Flags: ··········S·]
    Window: 65535
    [Calculated window size: 65535]
    Checksum: 0xc4ee [unverified]
    [Checksum Status: Unverified]
    Urgent Pointer: 0
    Options: (12 bytes), Maximum segment size, No-Operation (NOP), Window scale, No-Operation (NOP), No-Operation (NOP), SACK permitted
        TCP Option - Maximum segment size: 1440 bytes
            Kind: Maximum Segment Size (2)
            Length: 4
            MSS Value: 1440
        TCP Option - No-Operation (NOP)
            Kind: No-Operation (1)
        TCP Option - Window scale: 8 (multiply by 256)
            Kind: Window Scale (3)
            Length: 3
            Shift count: 8
            [Multiplier: 256]
        TCP Option - No-Operation (NOP)
            Kind: No-Operation (1)
        TCP Option - No-Operation (NOP)
            Kind: No-Operation (1)
        TCP Option - SACK permitted
            Kind: SACK Permitted (4)
            Length: 2
    [Timestamps]
        [Time since first frame in this TCP stream: 0.000000000 seconds]
        [Time since previous frame in this TCP stream: 0.000000000 seconds]

Frame 8: 86 bytes on wire (688 bits), 86 bytes captured (688 bits)
    Encapsulation type: Ethernet (1)
    Arrival Time: Oct  8, 2025 00:41:58.363198000 EDT
    UTC Arrival Time: Oct  8, 2025 04:41:58.363198000 UTC
    Epoch Arrival Time: 1759898518.363198000
    [Time shift for this packet: 0.000000000 seconds]
    [Time delta from previous captured frame: 0.127749000 seconds]
    [Time delta from previous displayed frame: 0.127749000 seconds]
    [Time since reference or first frame: 0.371246000 seconds]
    Frame Number: 8
    Frame Length: 86 bytes (688 bits)
    Capture Length: 86 bytes (688 bits)
    [Frame is marked: False]
    [Frame is ignored: False]
    [Protocols in frame: eth:ethertype:ipv6:tcp]
Ethernet II, Src: 2e:b4:69:6b:dd:a0 (2e:b4:69:6b:dd:a0), Dst: CloudNetwork_28:03:b3 (d8:b3:2f:28:03:b3)
    Destination: CloudNetwork_28:03:b3 (d8:b3:2f:28:03:b3)
        .... ..0. .... .... .... .... = LG bit: Globally unique address (factory default)
        .... ...0 .... .... .... .... = IG bit: Individual address (unicast)
    Source: 2e:b4:69:6b:dd:a0 (2e:b4:69:6b:dd:a0)
        .... ..1. .... .... .... .... = LG bit: Locally administered address (this is NOT the factory default)
        .... ...0 .... .... .... .... = IG bit: Individual address (unicast)
    Type: IPv6 (0x86dd)
    [Stream index: 0]
Internet Protocol Version 6, Src: 2603:1063:27:2::14, Dst: 2402:3a80:1e0d:5b9a:3004:d403:d45b:e140
    0110 .... = Version: 6
    .... 1000 1000 .... .... .... .... .... = Traffic Class: 0x88 (DSCP: AF41, ECN: Not-ECT)
        .... 1000 10.. .... .... .... .... .... = Differentiated Services Codepoint: Assured Forwarding 41 (34)
        .... .... ..00 .... .... .... .... .... = Explicit Congestion Notification: Not ECN-Capable Transport (0)
    .... 1101 1010 0000 0110 1000 = Flow Label: 0xda068
    Payload Length: 32
    Next Header: TCP (6)
    Hop Limit: 50
    Source Address: 2603:1063:27:2::14
        [Address Space: Global Unicast]
    Destination Address: 2402:3a80:1e0d:5b9a:3004:d403:d45b:e140
        [Address Space: Global Unicast]
    [Stream index: 1]
Transmission Control Protocol, Src Port: 443, Dst Port: 61017, Seq: 0, Ack: 1, Len: 0
    Source Port: 443
    Destination Port: 61017
    [Stream index: 0]
    [Stream Packet Number: 2]
    [Conversation completeness: Incomplete, SYN_SENT (1)]
        ..0. .... = RST: Absent
        ...0 .... = FIN: Absent
        .... 0... = Data: Absent
        .... .0.. = ACK: Absent
        .... ..0. = SYN-ACK: Absent
        .... ...1 = SYN: Present
        [Completeness Flags: ·····S]
    [TCP Segment Len: 0]
    Sequence Number: 0    (relative sequence number)
    Sequence Number (raw): 1556176821
    [Next Sequence Number: 1    (relative sequence number)]
    Acknowledgment Number: 1    (relative ack number)
    Acknowledgment number (raw): 1754892567
    1000 .... = Header Length: 32 bytes (8)
    Flags: 0x012 (SYN, ACK)
        000. .... .... = Reserved: Not set
        ...0 .... .... = Accurate ECN: Not set
        .... 0... .... = Congestion Window Reduced: Not set
        .... .0.. .... = ECN-Echo: Not set
        .... ..0. .... = Urgent: Not set
        .... ...1 .... = Acknowledgment: Set
        .... .... 0... = Push: Not set
        .... .... .0.. = Reset: Not set
        .... .... ..1. = Syn: Set
            [Expert Info (Chat/Sequence): Connection establish acknowledge (SYN+ACK): server port 443]
                [Connection establish acknowledge (SYN+ACK): server port 443]
                [Severity level: Chat]
                [Group: Sequence]
        .... .... ...0 = Fin: Not set
        [TCP Flags: ·······A··S·]
    Window: 65535
    [Calculated window size: 65535]
    Checksum: 0x08cb [unverified]
    [Checksum Status: Unverified]
    Urgent Pointer: 0
    Options: (12 bytes), Maximum segment size, No-Operation (NOP), Window scale, No-Operation (NOP), No-Operation (NOP), SACK permitted
        TCP Option - Maximum segment size: 1340 bytes
            Kind: Maximum Segment Size (2)
            Length: 4
            MSS Value: 1340
        TCP Option - No-Operation (NOP)
            Kind: No-Operation (1)
        TCP Option - Window scale: 8 (multiply by 256)
            Kind: Window Scale (3)
            Length: 3
            Shift count: 8
            [Multiplier: 256]
        TCP Option - No-Operation (NOP)
            Kind: No-Operation (1)
        TCP Option - No-Operation (NOP)
            Kind: No-Operation (1)
        TCP Option - SACK permitted
            Kind: SACK Permitted (4)
            Length: 2
    [Timestamps]
        [Time since first frame in this TCP stream: 0.127749000 seconds]
        [Time since previous frame in this TCP stream: 0.127749000 seconds]
    [SEQ/ACK analysis]
        [This is an ACK to the segment in frame: 7]
        [The RTT to ACK the segment was: 0.127749000 seconds]

Frame 9: 74 bytes on wire (592 bits), 74 bytes captured (592 bits)
    Encapsulation type: Ethernet (1)
    Arrival Time: Oct  8, 2025 00:41:58.363200000 EDT
    UTC Arrival Time: Oct  8, 2025 04:41:58.363200000 UTC
    Epoch Arrival Time: 1759898518.363200000
    [Time shift for this packet: 0.000000000 seconds]
    [Time delta from previous captured frame: 0.000002000 seconds]
    [Time delta from previous displayed frame: 0.000002000 seconds]
    [Time since reference or first frame: 0.371248000 seconds]
    Frame Number: 9
    Frame Length: 74 bytes (592 bits)
    Capture Length: 74 bytes (592 bits)
    [Frame is marked: False]
    [Frame is ignored: False]
    [Protocols in frame: eth:ethertype:ipv6:tcp]
Ethernet II, Src: CloudNetwork_28:03:b3 (d8:b3:2f:28:03:b3), Dst: 2e:b4:69:6b:dd:a0 (2e:b4:69:6b:dd:a0)
    Destination: 2e:b4:69:6b:dd:a0 (2e:b4:69:6b:dd:a0)
        .... ..1. .... .... .... .... = LG bit: Locally administered address (this is NOT the factory default)
        .... ...0 .... .... .... .... = IG bit: Individual address (unicast)
    Source: CloudNetwork_28:03:b3 (d8:b3:2f:28:03:b3)
        .... ..0. .... .... .... .... = LG bit: Globally unique address (factory default)
        .... ...0 .... .... .... .... = IG bit: Individual address (unicast)
    Type: IPv6 (0x86dd)
    [Stream index: 0]
Internet Protocol Version 6, Src: 2402:3a80:1e0d:5b9a:3004:d403:d45b:e140, Dst: 2603:1063:27:2::14
    0110 .... = Version: 6
    .... 0000 0000 .... .... .... .... .... = Traffic Class: 0x00 (DSCP: CS0, ECN: Not-ECT)
        .... 0000 00.. .... .... .... .... .... = Differentiated Services Codepoint: Default (0)
        .... .... ..00 .... .... .... .... .... = Explicit Congestion Notification: Not ECN-Capable Transport (0)
    .... 0111 0111 0000 0101 1111 = Flow Label: 0x7705f
    Payload Length: 20
    Next Header: TCP (6)
    Hop Limit: 254
    Source Address: 2402:3a80:1e0d:5b9a:3004:d403:d45b:e140
        [Address Space: Global Unicast]
    Destination Address: 2603:1063:27:2::14
        [Address Space: Global Unicast]
    [Stream index: 1]
Transmission Control Protocol, Src Port: 61017, Dst Port: 443, Seq: 1, Ack: 1, Len: 0
    Source Port: 61017
    Destination Port: 443
    [Stream index: 0]
    [Stream Packet Number: 3]
    [Conversation completeness: Incomplete, CLIENT_ESTABLISHED (3)]
        ..0. .... = RST: Absent
        ...0 .... = FIN: Absent
        .... 0... = Data: Absent
        .... .0.. = ACK: Absent
        .... ..1. = SYN-ACK: Present
        .... ...1 = SYN: Present
        [Completeness Flags: ····SS]
    [TCP Segment Len: 0]
    Sequence Number: 1    (relative sequence number)
    Sequence Number (raw): 1754892567
    [Next Sequence Number: 1    (relative sequence number)]
    Acknowledgment Number: 1    (relative ack number)
    Acknowledgment number (raw): 1556176822
    0101 .... = Header Length: 20 bytes (5)
    Flags: 0x010 (ACK)
        000. .... .... = Reserved: Not set
        ...0 .... .... = Accurate ECN: Not set
        .... 0... .... = Congestion Window Reduced: Not set
        .... .0.. .... = ECN-Echo: Not set
        .... ..0. .... = Urgent: Not set
        .... ...1 .... = Acknowledgment: Set
        .... .... 0... = Push: Not set
        .... .... .0.. = Reset: Not set
        .... .... ..0. = Syn: Not set
