Frame 1: 342 bytes on wire (2736 bits), 342 bytes captured (2736 bits)
    Encapsulation type: Ethernet (1)
    Arrival Time: Sep 30, 2025 11:33:50.751289000 EDT
    UTC Arrival Time: Sep 30, 2025 15:33:50.751289000 UTC
    Epoch Arrival Time: 1759246430.751289000
    [Time shift for this packet: 0.000000000 seconds]
    [Time delta from previous captured frame: 0.000000000 seconds]
    [Time delta from previous displayed frame: 0.000000000 seconds]
    [Time since reference or first frame: 0.000000000 seconds]
    Frame Number: 1
    Frame Length: 342 bytes (2736 bits)
    Capture Length: 342 bytes (2736 bits)
    [Frame is marked: False]
    [Frame is ignored: False]
    [Protocols in frame: eth:ethertype:ip:udp:dhcp]
Ethernet II, Src: PCSSystemtec_0a:e1:b0 (08:00:27:0a:e1:b0), Dst: 2e:b4:69:6b:dd:a0 (2e:b4:69:6b:dd:a0)
    Destination: 2e:b4:69:6b:dd:a0 (2e:b4:69:6b:dd:a0)
        .... ..1. .... .... .... .... = LG bit: Locally administered address (this is NOT the factory default)
        .... ...0 .... .... .... .... = IG bit: Individual address (unicast)
    Source: PCSSystemtec_0a:e1:b0 (08:00:27:0a:e1:b0)
        .... ..0. .... .... .... .... = LG bit: Globally unique address (factory default)
        .... ...0 .... .... .... .... = IG bit: Individual address (unicast)
    Type: IPv4 (0x0800)
    [Stream index: 0]
Internet Protocol Version 4, Src: 10.239.252.202, Dst: 10.239.252.119
    0100 .... = Version: 4
    .... 0101 = Header Length: 20 bytes (5)
    Differentiated Services Field: 0x00 (DSCP: CS0, ECN: Not-ECT)
        0000 00.. = Differentiated Services Codepoint: Default (0)
        .... ..00 = Explicit Congestion Notification: Not ECN-Capable Transport (0)
    Total Length: 328
    Identification: 0x0000 (0)
    010. .... = Flags: 0x2, Don't fragment
        0... .... = Reserved bit: Not set
        .1.. .... = Don't fragment: Set
        ..0. .... = More fragments: Not set
    ...0 0000 0000 0000 = Fragment Offset: 0
    Time to Live: 64
    Protocol: UDP (17)
    Header Checksum: 0x2a85 [validation disabled]
    [Header checksum status: Unverified]
    Source Address: 10.239.252.202
    Destination Address: 10.239.252.119
    [Stream index: 0]
User Datagram Protocol, Src Port: 68, Dst Port: 67
    Source Port: 68
    Destination Port: 67
    Length: 308
    Checksum: 0x6ffc [unverified]
    [Checksum Status: Unverified]
    [Stream index: 0]
    [Stream Packet Number: 1]
    [Timestamps]
        [Time since first frame: 0.000000000 seconds]
        [Time since previous frame: 0.000000000 seconds]
    UDP payload (300 bytes)
Dynamic Host Configuration Protocol (Request)
    Message type: Boot Request (1)
    Hardware type: Ethernet (0x01)
    Hardware address length: 6
    Hops: 0
    Transaction ID: 0x303ee21e
    Seconds elapsed: 1236
    Bootp flags: 0x0000 (Unicast)
        0... .... .... .... = Broadcast flag: Unicast
        .000 0000 0000 0000 = Reserved flags: 0x0000
    Client IP address: 10.239.252.202
    Your (client) IP address: 0.0.0.0
    Next server IP address: 0.0.0.0
    Relay agent IP address: 0.0.0.0
    Client MAC address: PCSSystemtec_0a:e1:b0 (08:00:27:0a:e1:b0)
    Client hardware address padding: 00000000000000000000
    Server host name not given
    Boot file name not given
    Magic cookie: DHCP
    Option: (53) DHCP Message Type (Request)
        Length: 1
        DHCP: Request (3)
    Option: (55) Parameter Request List
        Length: 8
        Parameter Request List Item: (1) Subnet Mask
        Parameter Request List Item: (28) Broadcast Address
        Parameter Request List Item: (2) Time Offset
        Parameter Request List Item: (3) Router
        Parameter Request List Item: (15) Domain Name
        Parameter Request List Item: (6) Domain Name Server
        Parameter Request List Item: (12) Host Name
        Parameter Request List Item: (42) Network Time Protocol Servers
    Option: (255) End
        Option End: 255
    Padding: 00000000000000000000000000000000000000000000000000000000000000000000000000000000000000000000

Frame 2: 75 bytes on wire (600 bits), 75 bytes captured (600 bits)
    Encapsulation type: Ethernet (1)
    Arrival Time: Sep 30, 2025 11:33:50.890672000 EDT
    UTC Arrival Time: Sep 30, 2025 15:33:50.890672000 UTC
    Epoch Arrival Time: 1759246430.890672000
    [Time shift for this packet: 0.000000000 seconds]
    [Time delta from previous captured frame: 0.139383000 seconds]
    [Time delta from previous displayed frame: 0.139383000 seconds]
    [Time since reference or first frame: 0.139383000 seconds]
    Frame Number: 2
    Frame Length: 75 bytes (600 bits)
    Capture Length: 75 bytes (600 bits)
    [Frame is marked: False]
    [Frame is ignored: False]
    [Protocols in frame: eth:ethertype:ipv6:tcp]
Ethernet II, Src: CloudNetwork_28:03:b3 (d8:b3:2f:28:03:b3), Dst: 2e:b4:69:6b:dd:a0 (2e:b4:69:6b:dd:a0)
    Destination: 2e:b4:69:6b:dd:a0 (2e:b4:69:6b:dd:a0)
        .... ..1. .... .... .... .... = LG bit: Locally administered address (this is NOT the factory default)
        .... ...0 .... .... .... .... = IG bit: Individual address (unicast)
    Source: CloudNetwork_28:03:b3 (d8:b3:2f:28:03:b3)
        .... ..0. .... .... .... .... = LG bit: Globally unique address (factory default)
        .... ...0 .... .... .... .... = IG bit: Individual address (unicast)
    Type: IPv6 (0x86dd)
    [Stream index: 1]
Internet Protocol Version 6, Src: 2402:3a80:4225:2b37:550b:b939:288f:d13d, Dst: 2620:1ec:33::11
    0110 .... = Version: 6
    .... 0000 0000 .... .... .... .... .... = Traffic Class: 0x00 (DSCP: CS0, ECN: Not-ECT)
        .... 0000 00.. .... .... .... .... .... = Differentiated Services Codepoint: Default (0)
        .... .... ..00 .... .... .... .... .... = Explicit Congestion Notification: Not ECN-Capable Transport (0)
    .... 0011 0111 0000 0000 0001 = Flow Label: 0x37001
    Payload Length: 21
    Next Header: TCP (6)
    Hop Limit: 254
    Source Address: 2402:3a80:4225:2b37:550b:b939:288f:d13d
        [Address Space: Global Unicast]
    Destination Address: 2620:1ec:33::11
        [Address Space: Global Unicast]
    [Stream index: 0]
Transmission Control Protocol, Src Port: 51852, Dst Port: 443, Seq: 1, Ack: 1, Len: 1
    Source Port: 51852
    Destination Port: 443
    [Stream index: 0]
    [Stream Packet Number: 1]
    [Conversation completeness: Incomplete (0)]
        ..0. .... = RST: Absent
        ...0 .... = FIN: Absent
        .... 0... = Data: Absent
        .... .0.. = ACK: Absent
        .... ..0. = SYN-ACK: Absent
        .... ...0 = SYN: Absent
        [Completeness Flags: [ Null ]]
    [TCP Segment Len: 1]
    Sequence Number: 1    (relative sequence number)
    Sequence Number (raw): 153250520
    [Next Sequence Number: 2    (relative sequence number)]
    Acknowledgment Number: 1    (relative ack number)
    Acknowledgment number (raw): 1841717635
    0101 .... = Header Length: 20 bytes (5)
    Flags: 0x010 (ACK)
        000. .... .... = Reserved: Not set
        ...0 .... .... = Accurate ECN: Not set
        .... 0... .... = Congestion Window Reduced: Not set
        .... .0.. .... = ECN-Echo: Not set
        .... ..0. .... = Urgent: Not set
        .... ...1 .... = Acknowledgment: Set
        .... .... 0... = Push: Not set
        .... .... .0.. = Reset: Not set
        .... .... ..0. = Syn: Not set
        .... .... ...0 = Fin: Not set
        [TCP Flags: ·······A····]
    Window: 255
    [Calculated window size: 255]
    [Window size scaling factor: -1 (unknown)]
    Checksum: 0xa308 [unverified]
    [Checksum Status: Unverified]
    Urgent Pointer: 0
    [Timestamps]
        [Time since first frame in this TCP stream: 0.000000000 seconds]
        [Time since previous frame in this TCP stream: 0.000000000 seconds]
    [SEQ/ACK analysis]
        [Bytes in flight: 1]
        [Bytes sent since last PSH flag: 1]
    TCP payload (1 byte)
    TCP segment data (1 byte)
Transport Layer Security

Frame 3: 86 bytes on wire (688 bits), 86 bytes captured (688 bits)
    Encapsulation type: Ethernet (1)
    Arrival Time: Sep 30, 2025 11:33:51.049840000 EDT
    UTC Arrival Time: Sep 30, 2025 15:33:51.049840000 UTC
    Epoch Arrival Time: 1759246431.049840000
    [Time shift for this packet: 0.000000000 seconds]
    [Time delta from previous captured frame: 0.159168000 seconds]
    [Time delta from previous displayed frame: 0.159168000 seconds]
    [Time since reference or first frame: 0.298551000 seconds]
    Frame Number: 3
    Frame Length: 86 bytes (688 bits)
    Capture Length: 86 bytes (688 bits)
    [Frame is marked: False]
    [Frame is ignored: False]
    [Protocols in frame: eth:ethertype:ipv6:tcp]
Ethernet II, Src: 2e:b4:69:6b:dd:a0 (2e:b4:69:6b:dd:a0), Dst: CloudNetwork_28:03:b3 (d8:b3:2f:28:03:b3)
    Destination: CloudNetwork_28:03:b3 (d8:b3:2f:28:03:b3)
        .... ..0. .... .... .... .... = LG bit: Globally unique address (factory default)
        .... ...0 .... .... .... .... = IG bit: Individual address (unicast)
    Source: 2e:b4:69:6b:dd:a0 (2e:b4:69:6b:dd:a0)
        .... ..1. .... .... .... .... = LG bit: Locally administered address (this is NOT the factory default)
        .... ...0 .... .... .... .... = IG bit: Individual address (unicast)
    Type: IPv6 (0x86dd)
    [Stream index: 1]
Internet Protocol Version 6, Src: 2620:1ec:33::11, Dst: 2402:3a80:4225:2b37:550b:b939:288f:d13d
    0110 .... = Version: 6
    .... 1000 1000 .... .... .... .... .... = Traffic Class: 0x88 (DSCP: AF41, ECN: Not-ECT)
        .... 1000 10.. .... .... .... .... .... = Differentiated Services Codepoint: Assured Forwarding 41 (34)
        .... .... ..00 .... .... .... .... .... = Explicit Congestion Notification: Not ECN-Capable Transport (0)
    .... 0100 1100 0011 0001 1010 = Flow Label: 0x4c31a
    Payload Length: 32
    Next Header: TCP (6)
    Hop Limit: 51
    Source Address: 2620:1ec:33::11
        [Address Space: Global Unicast]
    Destination Address: 2402:3a80:4225:2b37:550b:b939:288f:d13d
        [Address Space: Global Unicast]
    [Stream index: 0]
Transmission Control Protocol, Src Port: 443, Dst Port: 51852, Seq: 1, Ack: 2, Len: 0
    Source Port: 443
    Destination Port: 51852
    [Stream index: 0]
    [Stream Packet Number: 2]
    [Conversation completeness: Incomplete (8)]
        ..0. .... = RST: Absent
        ...0 .... = FIN: Absent
        .... 1... = Data: Present
        .... .0.. = ACK: Absent
        .... ..0. = SYN-ACK: Absent
        .... ...0 = SYN: Absent
        [Completeness Flags: ··D···]
    [TCP Segment Len: 0]
    Sequence Number: 1    (relative sequence number)
    Sequence Number (raw): 1841717635
    [Next Sequence Number: 1    (relative sequence number)]
    Acknowledgment Number: 2    (relative ack number)
    Acknowledgment number (raw): 153250521
    1000 .... = Header Length: 32 bytes (8)
    Flags: 0x010 (ACK)
        000. .... .... = Reserved: Not set
        ...0 .... .... = Accurate ECN: Not set
        .... 0... .... = Congestion Window Reduced: Not set
        .... .0.. .... = ECN-Echo: Not set
        .... ..0. .... = Urgent: Not set
        .... ...1 .... = Acknowledgment: Set
        .... .... 0... = Push: Not set
        .... .... .0.. = Reset: Not set
        .... .... ..0. = Syn: Not set
        .... .... ...0 = Fin: Not set
        [TCP Flags: ·······A····]
    Window: 16383
    [Calculated window size: 16383]
    [Window size scaling factor: -1 (unknown)]
    Checksum: 0x45fb [unverified]
    [Checksum Status: Unverified]
    Urgent Pointer: 0
    Options: (12 bytes), No-Operation (NOP), No-Operation (NOP), SACK
        TCP Option - No-Operation (NOP)
            Kind: No-Operation (1)
        TCP Option - No-Operation (NOP)
            Kind: No-Operation (1)
        TCP Option - SACK 1-2
            Kind: SACK (5)
            Length: 10
            left edge = 1 (relative)
            right edge = 2 (relative)
            [TCP SACK Count: 1]
            [D-SACK Left Edge = 1 (relative)]
            [D-SACK Right Edge = 2 (relative)]
            D-SACK Sequence
                [Expert Info (Warning/Sequence): D-SACK Sequence]
                    [D-SACK Sequence]
                    [Severity level: Warning]
                    [Group: Sequence]
    [Timestamps]
        [Time since first frame in this TCP stream: 0.159168000 seconds]
        [Time since previous frame in this TCP stream: 0.159168000 seconds]
    [SEQ/ACK analysis]
        [This is an ACK to the segment in frame: 2]
        [The RTT to ACK the segment was: 0.159168000 seconds]

Frame 4: 75 bytes on wire (600 bits), 75 bytes captured (600 bits)
    Encapsulation type: Ethernet (1)
    Arrival Time: Sep 30, 2025 11:33:51.403049000 EDT
    UTC Arrival Time: Sep 30, 2025 15:33:51.403049000 UTC
    Epoch Arrival Time: 1759246431.403049000
    [Time shift for this packet: 0.000000000 seconds]
    [Time delta from previous captured frame: 0.353209000 seconds]
    [Time delta from previous displayed frame: 0.353209000 seconds]
    [Time since reference or first frame: 0.651760000 seconds]
    Frame Number: 4
    Frame Length: 75 bytes (600 bits)
    Capture Length: 75 bytes (600 bits)
    [Frame is marked: False]
    [Frame is ignored: False]
    [Protocols in frame: eth:ethertype:ipv6:tcp]
Ethernet II, Src: CloudNetwork_28:03:b3 (d8:b3:2f:28:03:b3), Dst: 2e:b4:69:6b:dd:a0 (2e:b4:69:6b:dd:a0)
    Destination: 2e:b4:69:6b:dd:a0 (2e:b4:69:6b:dd:a0)
        .... ..1. .... .... .... .... = LG bit: Locally administered address (this is NOT the factory default)
        .... ...0 .... .... .... .... = IG bit: Individual address (unicast)
    Source: CloudNetwork_28:03:b3 (d8:b3:2f:28:03:b3)
        .... ..0. .... .... .... .... = LG bit: Globally unique address (factory default)
        .... ...0 .... .... .... .... = IG bit: Individual address (unicast)
    Type: IPv6 (0x86dd)
    [Stream index: 1]
Internet Protocol Version 6, Src: 2402:3a80:4225:2b37:550b:b939:288f:d13d, Dst: 2a06:98c1:3100::6812:202f
    0110 .... = Version: 6
    .... 0000 0000 .... .... .... .... .... = Traffic Class: 0x00 (DSCP: CS0, ECN: Not-ECT)
        .... 0000 00.. .... .... .... .... .... = Differentiated Services Codepoint: Default (0)
        .... .... ..00 .... .... .... .... .... = Explicit Congestion Notification: Not ECN-Capable Transport (0)
    .... 0100 1100 0011 0100 1011 = Flow Label: 0x4c34b
    Payload Length: 21
    Next Header: TCP (6)
    Hop Limit: 254
    Source Address: 2402:3a80:4225:2b37:550b:b939:288f:d13d
        [Address Space: Global Unicast]
    Destination Address: 2a06:98c1:3100::6812:202f
        [Address Space: Global Unicast]
    [Stream index: 1]
Transmission Control Protocol, Src Port: 51826, Dst Port: 443, Seq: 1, Ack: 1, Len: 1
    Source Port: 51826
    Destination Port: 443
    [Stream index: 1]
    [Stream Packet Number: 1]
    [Conversation completeness: Incomplete (0)]
        ..0. .... = RST: Absent
        ...0 .... = FIN: Absent
        .... 0... = Data: Absent
        .... .0.. = ACK: Absent
        .... ..0. = SYN-ACK: Absent
        .... ...0 = SYN: Absent
        [Completeness Flags: [ Null ]]
    [TCP Segment Len: 1]
    Sequence Number: 1    (relative sequence number)
    Sequence Number (raw): 2832525858
    [Next Sequence Number: 2    (relative sequence number)]
    Acknowledgment Number: 1    (relative ack number)
    Acknowledgment number (raw): 2127550266
    0101 .... = Header Length: 20 bytes (5)
    Flags: 0x010 (ACK)
        000. .... .... = Reserved: Not set
        ...0 .... .... = Accurate ECN: Not set
        .... 0... .... = Congestion Window Reduced: Not set
        .... .0.. .... = ECN-Echo: Not set
        .... ..0. .... = Urgent: Not set
        .... ...1 .... = Acknowledgment: Set
        .... .... 0... = Push: Not set
        .... .... .0.. = Reset: Not set
        .... .... ..0. = Syn: Not set
        .... .... ...0 = Fin: Not set
        [TCP Flags: ·······A····]
    Window: 255
    [Calculated window size: 255]
    [Window size scaling factor: -1 (unknown)]
    Checksum: 0xa9ab [unverified]
    [Checksum Status: Unverified]
    Urgent Pointer: 0
    [Timestamps]
        [Time since first frame in this TCP stream: 0.000000000 seconds]
        [Time since previous frame in this TCP stream: 0.000000000 seconds]
    [SEQ/ACK analysis]
        [Bytes in flight: 1]
        [Bytes sent since last PSH flag: 1]
    TCP payload (1 byte)
    TCP segment data (1 byte)
Transport Layer Security

Frame 5: 86 bytes on wire (688 bits), 86 bytes captured (688 bits)
    Encapsulation type: Ethernet (1)
    Arrival Time: Sep 30, 2025 11:33:51.562629000 EDT
    UTC Arrival Time: Sep 30, 2025 15:33:51.562629000 UTC
    Epoch Arrival Time: 1759246431.562629000
    [Time shift for this packet: 0.000000000 seconds]
    [Time delta from previous captured frame: 0.159580000 seconds]
    [Time delta from previous displayed frame: 0.159580000 seconds]
    [Time since reference or first frame: 0.811340000 seconds]
    Frame Number: 5
    Frame Length: 86 bytes (688 bits)
    Capture Length: 86 bytes (688 bits)
    [Frame is marked: False]
    [Frame is ignored: False]
    [Protocols in frame: eth:ethertype:ipv6:tcp]
Ethernet II, Src: 2e:b4:69:6b:dd:a0 (2e:b4:69:6b:dd:a0), Dst: CloudNetwork_28:03:b3 (d8:b3:2f:28:03:b3)
    Destination: CloudNetwork_28:03:b3 (d8:b3:2f:28:03:b3)
        .... ..0. .... .... .... .... = LG bit: Globally unique address (factory default)
        .... ...0 .... .... .... .... = IG bit: Individual address (unicast)
    Source: 2e:b4:69:6b:dd:a0 (2e:b4:69:6b:dd:a0)
        .... ..1. .... .... .... .... = LG bit: Locally administered address (this is NOT the factory default)
        .... ...0 .... .... .... .... = IG bit: Individual address (unicast)
    Type: IPv6 (0x86dd)
    [Stream index: 1]
Internet Protocol Version 6, Src: 2a06:98c1:3100::6812:202f, Dst: 2402:3a80:4225:2b37:550b:b939:288f:d13d
    0110 .... = Version: 6
    .... 1000 1000 .... .... .... .... .... = Traffic Class: 0x88 (DSCP: AF41, ECN: Not-ECT)
        .... 1000 10.. .... .... .... .... .... = Differentiated Services Codepoint: Assured Forwarding 41 (34)
        .... .... ..00 .... .... .... .... .... = Explicit Congestion Notification: Not ECN-Capable Transport (0)
    .... 0111 1110 1101 1100 0000 = Flow Label: 0x7edc0
    Payload Length: 32
    Next Header: TCP (6)
    Hop Limit: 56
    Source Address: 2a06:98c1:3100::6812:202f
        [Address Space: Global Unicast]
    Destination Address: 2402:3a80:4225:2b37:550b:b939:288f:d13d
        [Address Space: Global Unicast]
    [Stream index: 1]
Transmission Control Protocol, Src Port: 443, Dst Port: 51826, Seq: 1, Ack: 2, Len: 0
    Source Port: 443
    Destination Port: 51826
    [Stream index: 1]
    [Stream Packet Number: 2]
    [Conversation completeness: Incomplete (8)]
        ..0. .... = RST: Absent
        ...0 .... = FIN: Absent
        .... 1... = Data: Present
        .... .0.. = ACK: Absent
        .... ..0. = SYN-ACK: Absent
        .... ...0 = SYN: Absent
        [Completeness Flags: ··D···]
    [TCP Segment Len: 0]
    Sequence Number: 1    (relative sequence number)
    Sequence Number (raw): 2127550266
    [Next Sequence Number: 1    (relative sequence number)]
    Acknowledgment Number: 2    (relative ack number)
    Acknowledgment number (raw): 2832525859
    1000 .... = Header Length: 32 bytes (8)
    Flags: 0x010 (ACK)
        000. .... .... = Reserved: Not set
        ...0 .... .... = Accurate ECN: Not set
        .... 0... .... = Congestion Window Reduced: Not set
        .... .0.. .... = ECN-Echo: Not set
        .... ..0. .... = Urgent: Not set
        .... ...1 .... = Acknowledgment: Set
        .... .... 0... = Push: Not set
        .... .... .0.. = Reset: Not set
        .... .... ..0. = Syn: Not set
        .... .... ...0 = Fin: Not set
        [TCP Flags: ·······A····]
    Window: 16
    [Calculated window size: 16]
    [Window size scaling factor: -1 (unknown)]
    Checksum: 0x4e93 [unverified]
    [Checksum Status: Unverified]
    Urgent Pointer: 0
    Options: (12 bytes), No-Operation (NOP), No-Operation (NOP), SACK
        TCP Option - No-Operation (NOP)
            Kind: No-Operation (1)
        TCP Option - No-Operation (NOP)
            Kind: No-Operation (1)
        TCP Option - SACK 1-2
            Kind: SACK (5)
            Length: 10
            left edge = 1 (relative)
            right edge = 2 (relative)
            [TCP SACK Count: 1]
            [D-SACK Left Edge = 1 (relative)]
            [D-SACK Right Edge = 2 (relative)]
            D-SACK Sequence
                [Expert Info (Warning/Sequence): D-SACK Sequence]
                    [D-SACK Sequence]
                    [Severity level: Warning]
                    [Group: Sequence]
    [Timestamps]
        [Time since first frame in this TCP stream: 0.159580000 seconds]
        [Time since previous frame in this TCP stream: 0.159580000 seconds]
    [SEQ/ACK analysis]
        [This is an ACK to the segment in frame: 4]
        [The RTT to ACK the segment was: 0.159580000 seconds]

Frame 6: 403 bytes on wire (3224 bits), 403 bytes captured (3224 bits)
    Encapsulation type: Ethernet (1)
    Arrival Time: Sep 30, 2025 11:33:52.783512000 EDT
    UTC Arrival Time: Sep 30, 2025 15:33:52.783512000 UTC
    Epoch Arrival Time: 1759246432.783512000
    [Time shift for this packet: 0.000000000 seconds]
    [Time delta from previous captured frame: 1.220883000 seconds]
    [Time delta from previous displayed frame: 1.220883000 seconds]
    [Time since reference or first frame: 2.032223000 seconds]
    Frame Number: 6
    Frame Length: 403 bytes (3224 bits)
    Capture Length: 403 bytes (3224 bits)
    [Frame is marked: False]
    [Frame is ignored: False]
    [Protocols in frame: eth:ethertype:ip:tcp]
Ethernet II, Src: 2e:b4:69:6b:dd:a0 (2e:b4:69:6b:dd:a0), Dst: CloudNetwork_28:03:b3 (d8:b3:2f:28:03:b3)
    Destination: CloudNetwork_28:03:b3 (d8:b3:2f:28:03:b3)
        .... ..0. .... .... .... .... = LG bit: Globally unique address (factory default)
        .... ...0 .... .... .... .... = IG bit: Individual address (unicast)
    Source: 2e:b4:69:6b:dd:a0 (2e:b4:69:6b:dd:a0)
        .... ..1. .... .... .... .... = LG bit: Locally administered address (this is NOT the factory default)
        .... ...0 .... .... .... .... = IG bit: Individual address (unicast)
    Type: IPv4 (0x0800)
    [Stream index: 1]
Internet Protocol Version 4, Src: 57.144.213.33, Dst: 10.239.252.152
    0100 .... = Version: 4
    .... 0101 = Header Length: 20 bytes (5)
    Differentiated Services Field: 0x88 (DSCP: AF41, ECN: Not-ECT)
        1000 10.. = Differentiated Services Codepoint: Assured Forwarding 41 (34)
        .... ..00 = Explicit Congestion Notification: Not ECN-Capable Transport (0)
    Total Length: 389
    Identification: 0x8ba4 (35748)
    010. .... = Flags: 0x2, Don't fragment
        0... .... = Reserved bit: Not set
        .1.. .... = Don't fragment: Set
        ..0. .... = More fragments: Not set
    ...0 0000 0000 0000 = Fragment Offset: 0
    Time to Live: 46
    Protocol: TCP (6)
    Header Checksum: 0xa90d [validation disabled]
    [Header checksum status: Unverified]
    Source Address: 57.144.213.33
    Destination Address: 10.239.252.152
    [Stream index: 1]
Transmission Control Protocol, Src Port: 80, Dst Port: 51806, Seq: 1, Ack: 1, Len: 349
    Source Port: 80
    Destination Port: 51806
    [Stream index: 2]
    [Stream Packet Number: 1]
    [Conversation completeness: Incomplete (0)]
        ..0. .... = RST: Absent
        ...0 .... = FIN: Absent
        .... 0... = Data: Absent
        .... .0.. = ACK: Absent
        .... ..0. = SYN-ACK: Absent
        .... ...0 = SYN: Absent
        [Completeness Flags: [ Null ]]
    [TCP Segment Len: 349]
    Sequence Number: 1    (relative sequence number)
    Sequence Number (raw): 3396561452
    [Next Sequence Number: 350    (relative sequence number)]
    Acknowledgment Number: 1    (relative ack number)
    Acknowledgment number (raw): 3516160290
    0101 .... = Header Length: 20 bytes (5)
    Flags: 0x018 (PSH, ACK)
        000. .... .... = Reserved: Not set
        ...0 .... .... = Accurate ECN: Not set
        .... 0... .... = Congestion Window Reduced: Not set
        .... .0.. .... = ECN-Echo: Not set
        .... ..0. .... = Urgent: Not set
        .... ...1 .... = Acknowledgment: Set
        .... .... 1... = Push: Set
        .... .... .0.. = Reset: Not set
        .... .... ..0. = Syn: Not set
        .... .... ...0 = Fin: Not set
        [TCP Flags: ·······AP···]
    Window: 269
    [Calculated window size: 269]
    [Window size scaling factor: -1 (unknown)]
    Checksum: 0x218b [unverified]
    [Checksum Status: Unverified]
    Urgent Pointer: 0
    [Timestamps]
        [Time since first frame in this TCP stream: 0.000000000 seconds]
        [Time since previous frame in this TCP stream: 0.000000000 seconds]
    [SEQ/ACK analysis]
        [Bytes in flight: 349]
        [Bytes sent since last PSH flag: 349]
    TCP payload (349 bytes)

Frame 7: 113 bytes on wire (904 bits), 113 bytes captured (904 bits)
    Encapsulation type: Ethernet (1)
    Arrival Time: Sep 30, 2025 11:33:52.788302000 EDT
    UTC Arrival Time: Sep 30, 2025 15:33:52.788302000 UTC
    Epoch Arrival Time: 1759246432.788302000
    [Time shift for this packet: 0.000000000 seconds]
    [Time delta from previous captured frame: 0.004790000 seconds]
    [Time delta from previous displayed frame: 0.004790000 seconds]
    [Time since reference or first frame: 2.037013000 seconds]
    Frame Number: 7
    Frame Length: 113 bytes (904 bits)
    Capture Length: 113 bytes (904 bits)
    [Frame is marked: False]
    [Frame is ignored: False]
    [Protocols in frame: eth:ethertype:ip:tcp]
Ethernet II, Src: CloudNetwork_28:03:b3 (d8:b3:2f:28:03:b3), Dst: 2e:b4:69:6b:dd:a0 (2e:b4:69:6b:dd:a0)
    Destination: 2e:b4:69:6b:dd:a0 (2e:b4:69:6b:dd:a0)
        .... ..1. .... .... .... .... = LG bit: Locally administered address (this is NOT the factory default)
        .... ...0 .... .... .... .... = IG bit: Individual address (unicast)
    Source: CloudNetwork_28:03:b3 (d8:b3:2f:28:03:b3)
        .... ..0. .... .... .... .... = LG bit: Globally unique address (factory default)
        .... ...0 .... .... .... .... = IG bit: Individual address (unicast)
    Type: IPv4 (0x0800)
    [Stream index: 1]
Internet Protocol Version 4, Src: 10.239.252.152, Dst: 57.144.213.33
    0100 .... = Version: 4
    .... 0101 = Header Length: 20 bytes (5)
    Differentiated Services Field: 0x00 (DSCP: CS0, ECN: Not-ECT)
        0000 00.. = Differentiated Services Codepoint: Default (0)
        .... ..00 = Explicit Congestion Notification: Not ECN-Capable Transport (0)
    Total Length: 99
    Identification: 0xcdce (52686)
    010. .... = Flags: 0x2, Don't fragment
        0... .... = Reserved bit: Not set
        .1.. .... = Don't fragment: Set
        ..0. .... = More fragments: Not set
    ...0 0000 0000 0000 = Fragment Offset: 0
    Time to Live: 128
    Protocol: TCP (6)
    Header Checksum: 0x168d [validation disabled]
    [Header checksum status: Unverified]
    Source Address: 10.239.252.152
    Destination Address: 57.144.213.33
    [Stream index: 1]
Transmission Control Protocol, Src Port: 51806, Dst Port: 80, Seq: 1, Ack: 350, Len: 59
    Source Port: 51806
    Destination Port: 80
    [Stream index: 2]
    [Stream Packet Number: 2]
    [Conversation completeness: Incomplete (8)]
        ..0. .... = RST: Absent
        ...0 .... = FIN: Absent
        .... 1... = Data: Present
        .... .0.. = ACK: Absent
        .... ..0. = SYN-ACK: Absent
        .... ...0 = SYN: Absent
        [Completeness Flags: ··D···]
    [TCP Segment Len: 59]
    Sequence Number: 1    (relative sequence number)
    Sequence Number (raw): 3516160290
    [Next Sequence Number: 60    (relative sequence number)]
    Acknowledgment Number: 350    (relative ack number)
    Acknowledgment number (raw): 3396561801
    0101 .... = Header Length: 20 bytes (5)
    Flags: 0x018 (PSH, ACK)
        000. .... .... = Reserved: Not set
        ...0 .... .... = Accurate ECN: Not set
        .... 0... .... = Congestion Window Reduced: Not set
        .... .0.. .... = ECN-Echo: Not set
        .... ..0. .... = Urgent: Not set
        .... ...1 .... = Acknowledgment: Set
        .... .... 1... = Push: Set
        .... .... .0.. = Reset: Not set
        .... .... ..0. = Syn: Not set
        .... .... ...0 = Fin: Not set
        [TCP Flags: ·······AP···]
    Window: 252
    [Calculated window size: 252]
    [Window size scaling factor: -1 (unknown)]
    Checksum: 0xe06b [unverified]
    [Checksum Status: Unverified]
    Urgent Pointer: 0
    [Timestamps]
        [Time since first frame in this TCP stream: 0.004790000 seconds]
        [Time since previous frame in this TCP stream: 0.004790000 seconds]
    [SEQ/ACK analysis]
        [This is an ACK to the segment in frame: 6]
        [The RTT to ACK the segment was: 0.004790000 seconds]
        [Bytes in flight: 59]
        [Bytes sent since last PSH flag: 59]
    TCP payload (59 bytes)

Frame 8: 60 bytes on wire (480 bits), 60 bytes captured (480 bits)
    Encapsulation type: Ethernet (1)
    Arrival Time: Sep 30, 2025 11:33:52.908905000 EDT
    UTC Arrival Time: Sep 30, 2025 15:33:52.908905000 UTC
    Epoch Arrival Time: 1759246432.908905000
    [Time shift for this packet: 0.000000000 seconds]
    [Time delta from previous captured frame: 0.120603000 seconds]
    [Time delta from previous displayed frame: 0.120603000 seconds]
    [Time since reference or first frame: 2.157616000 seconds]
    Frame Number: 8
    Frame Length: 60 bytes (480 bits)
    Capture Length: 60 bytes (480 bits)
    [Frame is marked: False]
    [Frame is ignored: False]
    [Protocols in frame: eth:ethertype:ip:tcp]
Ethernet II, Src: 2e:b4:69:6b:dd:a0 (2e:b4:69:6b:dd:a0), Dst: CloudNetwork_28:03:b3 (d8:b3:2f:28:03:b3)
    Destination: CloudNetwork_28:03:b3 (d8:b3:2f:28:03:b3)
        .... ..0. .... .... .... .... = LG bit: Globally unique address (factory default)
        .... ...0 .... .... .... .... = IG bit: Individual address (unicast)
    Source: 2e:b4:69:6b:dd:a0 (2e:b4:69:6b:dd:a0)
        .... ..1. .... .... .... .... = LG bit: Locally administered address (this is NOT the factory default)
        .... ...0 .... .... .... .... = IG bit: Individual address (unicast)
    Type: IPv4 (0x0800)
    [Stream index: 1]
    Padding: 000000000000
Internet Protocol Version 4, Src: 57.144.213.33, Dst: 10.239.252.152
    0100 .... = Version: 4
    .... 0101 = Header Length: 20 bytes (5)
    Differentiated Services Field: 0x88 (DSCP: AF41, ECN: Not-ECT)
        1000 10.. = Differentiated Services Codepoint: Assured Forwarding 41 (34)
        .... ..00 = Explicit Congestion Notification: Not ECN-Capable Transport (0)
    Total Length: 40
    Identification: 0x8ba5 (35749)
    010. .... = Flags: 0x2, Don't fragment
        0... .... = Reserved bit: Not set
        .1.. .... = Don't fragment: Set
        ..0. .... = More fragments: Not set
    ...0 0000 0000 0000 = Fragment Offset: 0
    Time to Live: 46
    Protocol: TCP (6)
    Header Checksum: 0xaa69 [validation disabled]
    [Header checksum status: Unverified]
    Source Address: 57.144.213.33
    Destination Address: 10.239.252.152
    [Stream index: 1]
Transmission Control Protocol, Src Port: 80, Dst Port: 51806, Seq: 350, Ack: 60, Len: 0
    Source Port: 80
    Destination Port: 51806
    [Stream index: 2]
    [Stream Packet Number: 3]
    [Conversation completeness: Incomplete (8)]
        ..0. .... = RST: Absent
        ...0 .... = FIN: Absent
        .... 1... = Data: Present
        .... .0.. = ACK: Absent
        .... ..0. = SYN-ACK: Absent
        .... ...0 = SYN: Absent
        [Completeness Flags: ··D···]
    [TCP Segment Len: 0]
    Sequence Number: 350    (relative sequence number)
    Sequence Number (raw): 3396561801
    [Next Sequence Number: 350    (relative sequence number)]
    Acknowledgment Number: 60    (relative ack number)
    Acknowledgment number (raw): 3516160349
    0101 .... = Header Length: 20 bytes (5)
    Flags: 0x010 (ACK)
        000. .... .... = Reserved: Not set
        ...0 .... .... = Accurate ECN: Not set
        .... 0... .... = Congestion Window Reduced: Not set
        .... .0.. .... = ECN-Echo: Not set
        .... ..0. .... = Urgent: Not set
        .... ...1 .... = Acknowledgment: Set
        .... .... 0... = Push: Not set
        .... .... .0.. = Reset: Not set
        .... .... ..0. = Syn: Not set
        .... .... ...0 = Fin: Not set
        [TCP Flags: ·······A····]
    Window: 269
    [Calculated window size: 269]
    [Window size scaling factor: -1 (unknown)]
    Checksum: 0x6cf0 [unverified]
    [Checksum Status: Unverified]
    Urgent Pointer: 0
    [Timestamps]
        [Time since first frame in this TCP stream: 0.125393000 seconds]
        [Time since previous frame in this TCP stream: 0.120603000 seconds]
    [SEQ/ACK analysis]
        [This is an ACK to the segment in frame: 7]
        [The RTT to ACK the segment was: 0.120603000 seconds]

Frame 9: 134 bytes on wire (1072 bits), 134 bytes captured (1072 bits)
    Encapsulation type: Ethernet (1)
    Arrival Time: Sep 30, 2025 11:33:53.188259000 EDT
    UTC Arrival Time: Sep 30, 2025 15:33:53.188259000 UTC
    Epoch Arrival Time: 1759246433.188259000
    [Time shift for this packet: 0.000000000 seconds]
    [Time delta from previous captured frame: 0.279354000 seconds]
    [Time delta from previous displayed frame: 0.279354000 seconds]
    [Time since reference or first frame: 2.436970000 seconds]
    Frame Number: 9
    Frame Length: 134 bytes (1072 bits)
    Capture Length: 134 bytes (1072 bits)
    [Frame is marked: False]
    [Frame is ignored: False]
    [Protocols in frame: eth:ethertype:ip:tcp]
Ethernet II, Src: 2e:b4:69:6b:dd:a0 (2e:b4:69:6b:dd:a0), Dst: CloudNetwork_28:03:b3 (d8:b3:2f:28:03:b3)
    Destination: CloudNetwork_28:03:b3 (d8:b3:2f:28:03:b3)
        .... ..0. .... .... .... .... = LG bit: Globally unique address (factory default)
        .... ...0 .... .... .... .... = IG bit: Individual address (unicast)
    Source: 2e:b4:69:6b:dd:a0 (2e:b4:69:6b:dd:a0)
        .... ..1. .... .... .... .... = LG bit: Locally administered address (this is NOT the factory default)
        .... ...0 .... .... .... .... = IG bit: Individual address (unicast)
    Type: IPv4 (0x0800)
    [Stream index: 1]
Internet Protocol Version 4, Src: 57.144.213.33, Dst: 10.239.252.152
    0100 .... = Version: 4
    .... 0101 = Header Length: 20 bytes (5)
    Differentiated Services Field: 0x88 (DSCP: AF41, ECN: Not-ECT)
        1000 10.. = Differentiated Services Codepoint: Assured Forwarding 41 (34)
        .... ..00 = Explicit Congestion Notification: Not ECN-Capable Transport (0)
    Total Length: 120
    Identification: 0x8ba6 (35750)
    010. .... = Flags: 0x2, Don't fragment
        0... .... = Reserved bit: Not set
        .1.. .... = Don't fragment: Set
        ..0. .... = More fragments: Not set
    ...0 0000 0000 0000 = Fragment Offset: 0
    Time to Live: 46
    Protocol: TCP (6)
    Header Checksum: 0xaa18 [validation disabled]
    [Header checksum status: Unverified]
    Source Address: 57.144.213.33
    Destination Address: 10.239.252.152
    [Stream index: 1]
Transmission Control Protocol, Src Port: 80, Dst Port: 51806, Seq: 350, Ack: 60, Len: 80
    Source Port: 80
    Destination Port: 51806
    [Stream index: 2]
    [Stream Packet Number: 4]
    [Conversation completeness: Incomplete (12)]
        ..0. .... = RST: Absent
        ...0 .... = FIN: Absent
        .... 1... = Data: Present
        .... .1.. = ACK: Present
        .... ..0. = SYN-ACK: Absent
        .... ...0 = SYN: Absent
        [Completeness Flags: ··DA··]
    [TCP Segment Len: 80]
    Sequence Number: 350    (relative sequence number)
    Sequence Number (raw): 3396561801
    [Next Sequence Number: 430    (relative sequence number)]
    Acknowledgment Number: 60    (relative ack number)
    Acknowledgment number (raw): 3516160349
    0101 .... = Header Length: 20 bytes (5)
    Flags: 0x018 (PSH, ACK)
        000. .... .... = Reserved: Not set
        ...0 .... .... = Accurate ECN: Not set
        .... 0... .... = Congestion Window Reduced: Not set
        .... .0.. .... = ECN-Echo: Not set
        .... ..0. .... = Urgent: Not set
        .... ...1 .... = Acknowledgment: Set
        .... .... 1... = Push: Set
        .... .... .0.. = Reset: Not set
        .... .... ..0. = Syn: Not set
        .... .... ...0 = Fin: Not set
        [TCP Flags: ·······AP···]
    Window: 269
    [Calculated window size: 269]
    [Window size scaling factor: -1 (unknown)]
    Checksum: 0x3be5 [unverified]
    [Checksum Status: Unverified]
    Urgent Pointer: 0
    [Timestamps]
        [Time since first frame in this TCP stream: 0.404747000 seconds]
        [Time since previous frame in this TCP stream: 0.279354000 seconds]
    [SEQ/ACK analysis]
        [Bytes in flight: 80]
        [Bytes sent since last PSH flag: 80]
    TCP payload (80 bytes)

Frame 10: 128 bytes on wire (1024 bits), 128 bytes captured (1024 bits)
    Encapsulation type: Ethernet (1)
    Arrival Time: Sep 30, 2025 11:33:53.189642000 EDT
    UTC Arrival Time: Sep 30, 2025 15:33:53.189642000 UTC
    Epoch Arrival Time: 1759246433.189642000
    [Time shift for this packet: 0.000000000 seconds]
    [Time delta from previous captured frame: 0.001383000 seconds]
    [Time delta from previous displayed frame: 0.001383000 seconds]
    [Time since reference or first frame: 2.438353000 seconds]
    Frame Number: 10
    Frame Length: 128 bytes (1024 bits)
    Capture Length: 128 bytes (1024 bits)
    [Frame is marked: False]
    [Frame is ignored: False]
    [Protocols in frame: eth:ethertype:ip:tcp]
Ethernet II, Src: CloudNetwork_28:03:b3 (d8:b3:2f:28:03:b3), Dst: 2e:b4:69:6b:dd:a0 (2e:b4:69:6b:dd:a0)
    Destination: 2e:b4:69:6b:dd:a0 (2e:b4:69:6b:dd:a0)
        .... ..1. .... .... .... .... = LG bit: Locally administered address (this is NOT the factory default)
        .... ...0 .... .... .... .... = IG bit: Individual address (unicast)
    Source: CloudNetwork_28:03:b3 (d8:b3:2f:28:03:b3)
        .... ..0. .... .... .... .... = LG bit: Globally unique address (factory default)
        .... ...0 .... .... .... .... = IG bit: Individual address (unicast)
    Type: IPv4 (0x0800)
    [Stream index: 1]
Internet Protocol Version 4, Src: 10.239.252.152, Dst: 57.144.213.33
    0100 .... = Version: 4
    .... 0101 = Header Length: 20 bytes (5)
    Differentiated Services Field: 0x00 (DSCP: CS0, ECN: Not-ECT)
        0000 00.. = Differentiated Services Codepoint: Default (0)
        .... ..00 = Explicit Congestion Notification: Not ECN-Capable Transport (0)
    Total Length: 114
    Identification: 0xcdcf (52687)
    010. .... = Flags: 0x2, Don't fragment
        0... .... = Reserved bit: Not set
        .1.. .... = Don't fragment: Set
        ..0. .... = More fragments: Not set
    ...0 0000 0000 0000 = Fragment Offset: 0
    Time to Live: 128
    Protocol: TCP (6)
    Header Checksum: 0x167d [validation disabled]
    [Header checksum status: Unverified]
    Source Address: 10.239.252.152
    Destination Address: 57.144.213.33
    [Stream index: 1]
Transmission Control Protocol, Src Port: 51806, Dst Port: 80, Seq: 60, Ack: 430, Len: 74
    Source Port: 51806
    Destination Port: 80
    [Stream index: 2]
    [Stream Packet Number: 5]
    [Conversation completeness: Incomplete (12)]
        ..0. .... = RST: Absent
        ...0 .... = FIN: Absent
        .... 1... = Data: Present
        .... .1.. = ACK: Present
        .... ..0. = SYN-ACK: Absent
        .... ...0 = SYN: Absent
        [Completeness Flags: ··DA··]
    [TCP Segment Len: 74]
    Sequence Number: 60    (relative sequence number)
    Sequence Number (raw): 3516160349
    [Next Sequence Number: 134    (relative sequence number)]
